Jordan_Arras,Proud citizen of Texas. Constitutional Conservative. Future Congressman. I believe in freedom, peace, and prosperity. Do you ?
natedbrbr,
DareSomething,Info Central For Political Activism, Conservative Issues, Republican, Libertarian, jschulmansr, ResistNet.Com, Tea Parties, my blogs, sites and much more...
BreadmanPat,I Love my family, I Love my freedom... I will fight to keep them both.
TribWire,News items from and about Texas, curated by The Texas Tribune. Retweets are not endorsements. Follow @texastribune on Twitter.
DanLJuneau,Tired of an over-regulated economy. Tired of paying higher taxes to governments that fail. Opinions come from 40 years of battles in government arenas...
toddstarnes,Fox News Host. Writer of Books. Syndicated Columnist. Southern by the Grace of God.
FriedrichHayek,Every individual knows only a little, and knows it only imperfectly, and no particular one of us is in a special position to say which ones of us knows best.
kinxbitz,Hard Right.
KyleSammin,Lawyer, writer. Contributor to @FDRLST, @Hardball_Times, @mcsweeneys. #NeverTrump
PastorGunny,Known to you & me as Joe the Policeman from the What's Going Down episode of That's My Momma. @TheProvChurch #TAMU @Cardinals I hate the DH!
EricHollander,Former Cruz for Pres State Director in IL, WI, and IN. Big time sports enthusiast, beach bum, world traveler and avid tennis player. RT'S are not endorsements.
RagCon,Conservative 

@marklevinshow
Cruz for President
Greymantle,#MITSloan #Innovation #Inventor #Cyber #RenewableEnergy #Army #Veteran #2A #Cat #Nashua #NH #SchoolBoard #StateRep #Liberty #ProLife #Catholic #SecularCarmelite
BrandonHawks,#Smalltown guy, with the #AmericanDream. #Politics, games, friends, and a activist for #Liberty, in a nutshell that's me. All #opinions expressed are my own!
KingFridaytcot,The important ones call me Pop-Pop. The King of sarcasm. 28 year Air Force Special Ops Vet. Limbaugh is left of me. Reluctant voter for Trump
MediaBiasPolice,#NeverHillary but still dislike Trump; Mod Conservative;Christian. Followd by: Dana Loesch, Jonathan Hoenig, James Rosen, Carrie Sheffield, Gianna Simone #pro2a
Keith_A_Self,Texan, West Point Grad, Reformer, Tax-Cutter, County Judge
CJB5775,Christian Conservative What doesn't kill you makes you stronger.  #2A #NRA #ΜΟΛΩΝΛΑΒΕ #pray #Israel #America #military FOLLOW ONLY LIKEMINDED PPL
ChrisHowie,Last seen @ (42.7550697, -84.5571474) via https://t.co/kv134Efwpx
mrsjcjones,M.A.-Exp.Psyc #eyetracking,   #HoustonAstros #StlCardinals #OKCThunder Native Houstonian, Christian Conservative
LUCKYNH603,Grateful to be an American! Pro-Second Amendment, Pro-Life and Pro-Military. America comes 1st. No apologies for what we believe or do! Period. #NHpol #NH
wdavidphillips,Recovering liberal. #ProLife #SmallGovernment #LowTaxes #FreeMarkets #LaborFreedom #PersonalLiberty #RuleofLaw Glory to the Father, the Son,  & the Holy Spirit
modernarch88,Architect thinking outside of the box.
kurt_nimmo,Editor and writer at http://t.co/Zp62v5HY7T.
robknoxious1,Sinner saved by Grace - Husband, Father, Gamer. Hoping GOP delegates Dump Trump. Won't vote for him regardless.
Fendervarius,Black Conservative-Anti Establishment-Tea Party-Christian-Serving Liberal Kryptonite Daily-MolonLabe
motowalkers,Riding motorcycles since 1961,RVN Airmobile 1967-1968 (TET) &1969-1970 Machinist for 20 years, Owned own business. DOD.  Retired
HenryLGomez,Father, husband, intransigent, freedom-loving, American-Cuban, conservatarian, capitalist, ad man, Gator. PJ Media/Babalu Blog Contributor. Gary Johnson 4 prez
toadtws,Lawyer seeking justice for all or, failing that, at least a nice glass of red.
KansasGOP,The official Twitter account of the Kansas Republican Party.
DrewRyun,Christian, conservative, athlete, fly fisherman, golfer, ping pong player, guitar, political animal, Media Trackers, Madison Project
kansasbabe,Very proud mom of three grown kids and five of the smartest, most handsome, and most wonderful grandsons ever.
sk8rgrl3,Professional Figure & Power Skating Coach. Born in DTW and raised in Canada. Lives in RVA via IL,MI,MN,DE. Michigan alum. Snap & Instagram @sk8rgrl3
LWilsonDarlene,For God, Family, and Country #AMEXIT #Christian #Sovereignty #TCOT #ConstitutionalConservative #2A #NRA #MolonLabe #WeThePeople #1A #TermLimits #WakeUpAmerica
RNRTexas,Texas #RedNationRising Account. Grassroots Organization for Education, Constitution, and Civics.
PatJohnson_8,Backup acct to @_PatJohnson_ 
#ProLife, Life, & (#2A) Protection of Life, Liberty  Liberty Pursuit of Happiness #Stand4Life #Tcot #CCOT #LNYHBT
drawandstrike,BREITBART IS HERE - DNC Media Narrative Destroyer - Texan - Gamer - Spends Lots Of Time Talking To Stupid People On Twitter
suemayonline,CHRISTIAN;GOD,FAMILY,COUNTRY,MUSIC,SAFETY+BABIES R my passions! ♥VETS!(Married;2 sons;6 grandchildren)What is the Period of PURPLE Crying?
jor71,#GOA Defender, Life-#NRA, #NJ2AS; #2A Warrior; #MolonLabe; Love my #Harley; #Bluehandfamily; #NeverHillary. I love my Family, God, Guns, & Country.
TroyTxFamilyDoc,Family doctor in Houston, Texas.  Interested in healthcare policy and improving access to healthcare. Any and all opinions expressed are my own.
debraraes,Artist, honorably discharged vet, tea party conservative, Pro Constitution, pro Israel, I block #BOTS
Sarahbelle_1,God fearing, Licensed gun owning Conservative. Liberals claim to love America yet their actions & policies CONSISTENTLY prove otherwise. Prove me wrong! #tcot
1VoiceMatters,❤️USA & I UNAPOLOGETICALLY put #USA & #Veterans 1st. #Conservative, #Capitalist #ProLife #ProMilitary & #AllLivesMatter #BLM cause deaths of COPS & KIDS!
IAMPCBob,Patriot, fiscal conservative, classical liberal, Navy & AF vet. I Support #FairTax & our Constitution. Let's return America to GREATNESS!  #tcot #TeaParty
DanProft,high school graduate
nelsonjgalan,Been There --- Done That
DanAldridge1,CEO https://t.co/Lf42yZpqlr @PrioritySW https://t.co/di6xPBoLn5 @iapperp Enterprise software NUT #ensw #erp Sucker 4 causes! #followback https://t.co/1NVQ4PaCll
BAMoonshadow,American Patriot #Liberty #Constitution #Space #NASA #X37B #Robotics #2ndAmendment ΜΟΛΩΝ ΛΑΒΕ #2A #Coffee #Chili #Peppers #Illinois #Colorado #Hiking
DebraFBloom,The most precious jewels you'll ever wear around your neck are the arms of your children. No RINO's here, this ain't no zoo. #CruzCrew
LeonHWolf,Managing Editor, https://t.co/3iVsWhN9pj. Don't be proud if I block you; I block all Trumpkins on sight.
GOPAmericanMom,#Christian #CancerAdvocate #2A #ReganConservative #Teaparty #HatesPlannedParenthood  #GodBlessAmerica! #MilitarySupporter #ExGOP #NeverTrump
autarkes,I keep my journals in a fireproof box. First book, #VictoryRuins, coming soon.
faramerican,Are you tired of the far right and the far left. What has happened to OUR country? Who Among Us Is Just Far American?
gracelnichols,Jesus paid it all - All to Him I owe . . . You are not your own, for you were bought with a price. So glorify God in your body. 1 Corinthians 6:19-20
MrJoshPerry,I like space #GYATM | Taylor Swift aficionado | Texas Red Dirt enthusiast: https://t.co/Hr4n8aF93X | Insta: @mrjoshperry | #NeverTrump
SierraKilo0811,USMC vet, Husband, Father, Papa, MOLON LABE, I BLOCK Trumpsters/Libtards/Establishment GOP, Apologizing is for pussies #NeverTrump
momwalks2,
ophidianpilot,Combat #Veteran  #NRA  #Israel  #TCOT  #PJNET  μολὼν λαβέ
   Hiss in this pit at your own risk
sogdog,de oppresso liber
hlaclark,Iowa Born, Raised and Proud. Trying to adjust to city life in Texas. I love Jesus, my husband, my kids and the Cyclones, in that order.
IWV,IWV fights against ObamaCare and the corrupt self-enrichment of govt worker unions while supporting economic literacy and sound policy on a range of issues.
Wilkie3,Jesus Freak (becaue He first ...) Husband to Kelly, Father of 2, Brother of 12, Member of Redeemer Church (awesome), SBA lender extraordinairre.
AvgJoeUSA,#Christian #Papaw #CruzCrew #NeverTrump #GOP is over! Trumpsters BLOCKED! We Don't Get Fooled Agagin!
Piscottas_Way,Tony attended the Finnish Sports Institute in Vierumaki. He writes for HockeysFuture and is pursuing a career in ice hockey coaching and management.
Gormogons,Global Terror. Val Kilmer. Hello Kitty. Policy. Politics. Vampires. Poland-Lithuanian Irredentism. Anti-Esperantism. Six posters: CZ, GP, GorT, MN, ŒV, & ℞.
cmortolani,Communists don’t like Christmas in particular, infact, they despise it, like Vampire's fleeing a cross. I Am The TeaParty!
PeterSomerville,I help Veterans & Main Street businesses get funding with loans backed by visionary investors @StreetShares. @USMC Veteran.
PruPaine,Conservative libertarian. Libertarian conservative. Southern gentility somewhat abraded by NY grit. Part serious/part silly #politix #media #music #film #books
JoeC1776,Ronald Reagan - I didn't leave the dem party, the dem party left me. This is where I am with the republican party! Considering voting libertarian for 1st time!
MPeale,You're going to call us racist, you're going to call us potential Timothy McVeighs? F*** you. - Andrew Breitbart  #TGDN Molṑn labé.
MrPanz,
will385,I tweet about hard rock & heavy metal music, gaming, comics, wrestling, boxing, history, military science, and politics.
Polly_Ticks,My mama named me Amblyomma Americanum but you can call me Polly.
KevinJDonaldson,CEO at @RWSolutionsInc, Man of Faith, Author, Life & Business Coach.  I teach people how to overcome adversity & succeed in all areas of their lives.#TFB
southgadiva,#TCOT I Pledge My Alligiance 2 Jesus Christ...Father Please Bring Our Nation Back To You!...Love Our Military Ppl & Israel #P4US #WAAR -❌NO LISTS!!
BryanJFischer,Host of Focal Point radio program on the 200-station American Family Radio network. Tweets are my own.
jasonrileywsj,Jason Riley is a senior fellow at the Manhattan Institute, a Wall Street Journal columnist and a Fox News commentator
PaulOD1,Conservative; Constitutionalist; Individual freedom & liberty key; Rule of Law fundamental to our country's survival as a nation of free people.
tedelaney2009,Engineer, programmer, amateur astronomer, genealogist, musicologist, reader, sports enthusiast
briankleinsmith,American, Conservative, Husband, Father, SigEp, and most importantly Christ Follower
AmericnElephant,Just your average, mild-mannered, all-American Elephant, blogging and photoshopping the apocalypse for peanuts!
shmuelsash,Ronald Reagan and @SenTedCruz are my heroes! I believe the sun will rise again over America! Join me in fighting corruption!
FSConservative,#CruzCrew | Stay away from they.
IN_PoolPlayer,Pool player. Sports, food, politics, and pop culture enthusiast.
MrsPerrin,Former Law Enforcmnt| #WriteInCruz  #NEVERtrump #NEVERhillary | #Conservative | #NRA |Christian Wife of #Navy #Vet |Animal Rehab |Followed by @RepDavid @KenWahl
rsquaredg,Libertarian leaning Tea Party conservative technologist - the views and posts expressed in this micro blog are my own and not endorsed by my employer.
jordanvalliere,★ We are born naked, wet and hungry. Then, things get worse. My favorite game is slap jack. ★
mikeyb3102,Conservative living in liberal CA. diehard #Kings #Raiders and #Dodgers fan. #RAT #NeverTrump #DelegateRevolt #FreetheDelegates
StevePerkins14,#NeverTrump because Bigot and Narcissist don't make good Presidents.
XDeimos,Constitutional Conservative | USA :) | #Christian | #DogsRule | 10+ Years #NRA | Support #IndieFilm | #ProIsrael | Love our #ArmedForces |  #ccot | Romans 10:9
boconnel,Conservative blogger, author, speaker surviving in a Deep Blue State and author of the new book Liberty's Lifeline
PineyRooter,Curmudgeon, Veteran, Patriot. My hair's turning white, my neck's always been red, my collars still blue. #FrederickDouglassrepublican #HoneyBadger
nickplee,Partner, CTO at Tendigi, Jazz Pianist, Chicken Parm Aficionado
gramemerson,Conservative/Christian/Wife/Mother/
Grandmother 
#NeverTrump
PatJohnson_5,Backup acct to @_PatJohnson_ 
#ProLife, Life, & (#2A) Protection of Life, Liberty  Liberty Pursuit of Happiness #Stand4Life #Tcot #CCOT #LNYHBT
rileysomething,That's right, I said it!
The_Real_Dust,
TeeDee1,Theresa Smith, FABULOUS, conservative, #NeverTrump. When do I get my damn money?    ¯\_(Oo)_/¯
Don't sweat the petty things, and don't pet the sweaty things.
sirvitup,I write for https://t.co/0W2AlsBXjX   Trump supporters.Do not follow.  I'll block. Proactively. I will not vote for a Democrat. Ever. #NeverTrump
SweetFreedom29,Conservative. Despise liberals. It's not about free stuff ... it's about FREEDOM #Benghazi #IRSScandal #VAScandal
LaCasaBoricua,Chase your passion, not your pension Denis Waitley Email: BassGitSing@yahoo.com Phone 719-685-6324 Worldwide 001-719-685-6324
severeconservat,Belief In God, The Constitution, The Bill of Rights, Freedom of Speech, Religion, Biology, Natural Marriage & Outlawing Surrogacy is not hate. Psalms 7:11
thmsm74,We need to take back our country. The left/progressive/liberals are trying to destroy us. We need to wake up and get back to our constitutional principles.
CoryWCrow,Frequently mistaken for someone who's not drinking heavily. It's a gift.

Lasciate ogne speranza, voi ch'intrate
soylentbeige,Fighting the ultimate battle between good & evil armed with a sharp tongue and armor-piercing truth. High information voter.
levmorgan,I am married to my husband Lee, have 3 children, and 8 beautiful grandkids.  Love music & movies
dcnite56,Saved by Grace. Retired Navy. Constitutionalist. #ccot #tcot Demand #voterID stop Democrat voter fraud. BLESS ISRAEL. Islam is the Enemy
DavidReed82,Jesus follower, Husband, Dad, Mentor to fatherless boys, Electrician, News Junkie, Raiders,Giants Fan,
billsbroadcast,Fmr Conservative Digest publisher believes Govt. is the problem not the solution . my life Purpose is to encourage others to trust God
ZIONforALL,Empower yourself with knowledge. Discover the truth about Israel, the Jewish Community, and the Middle-East Crisis. #IJM #Israel #Jewish #MideastCrisis
1Rock777,Husband of one wife, Father of five children, God fearing, bible believing, gun carring conservative.
IMakeAmerica,Nothing gets done in DC without making some noise... join our movement in support of U.S. manufacturing! A project of the Association of Equipment Manufacturers
rparham,Poltical junkie, sports nut, dad x2 & husband of @lindseyparham. 25+ years in TX & DC politics.
derrickjeter,Christian. Husband. Father. Texan. Storyteller. Writer. Speaker. Be Brave. Live Free.
hlwegley,Inspie thrillers: Climate of suspense & a forecast of stormy weather, https://t.co/ZRp4fIyw7m https://t.co/SVL0MOevll Thriller + romance Voice in the Wilderness
TCDwriter,Conservative writer & speaker.  Co-author: Waking the Sleeping Giant: How Mainstream Americans Can Beat Liberals at Their Own Game. RT's not endorsement.
DanzGeorge,Follow Founding Fathers, US Constitution (Promote Article I, Sec 8!), state's & private. prop. rights, Grow Tea Parties & Shrink Fed Gov.
bonhoefferbits,Silence in the face of evil is itself evil. Not to speak is to speak. Not to act is to act.
dave03102,NH DJ/MC/Event Coordinator
rpowell8124,I'm real & I'm spectacular.
Nymnurse,Nurses dispense comfort, compassion, and caring without even a prescription. #RN, #Mommy #Photography, #Conservatarian, #MetsTwitter, #Israel,  #FreeMilo
jjs92285,Proud parent, Constitutional Conservative, avid reader, STL sports junkie / Retweets ≠ endorsements. 
#neverTrumporHillary
backyardconserv,
SantosVictorero,#NonPC Independent Consultant on the analysis, design and implementation of Business Software, using #SDD, #SPAs, #DDD, #REST #WebAPIs, etc.♩♪♫♬
katyabram,Mom. Wife. Digital marketer. Former Emmy Nominated TV News Photojournalist. #2A. #WalkingDead addict. Tweets r mine & not that of my employer.
mpinkeyes,I am an amateur conservative/libertarian blogger trying to spread a vision of freedom and liberty as the founders saw it.
MemberVRWC,Conservative. Geek (Sr. Software Developer). Photographer (wildlife/nature).
1787American,☦God fearing Greek Orthodox Christian/Familia/Love For Liberty & The Men & Women who fight and die for It/Pathologist IC XC NI KA☦
GAGOPeach,The best argument against democracy is a five-minute conversation with the average voter. ~ Winston Churchill #RenegadesUnite #FrenchRevolution2016 #NeverTrump
number9r,Political correctness is a killer & when evil knocks on the door, don't answer it. #GIABO #SLA #deepdish
Grandmaster_Z,Cuban-American, unapologetic constitutional conservative. #TedCruz. Pro bal. budget. Pro flat tax. Pro military. Make USA no.1 again.
agabus98,Independent Pentecostal minister; Yashua is Lord!  Using God's Word in all of life, politics, preaching.  Living conservative is only way! Please, no profanity!
dupui,You have the power to change everything. My posts are my opinion Follower's posts are their opinion #God#Family#Country#Guns#NeverTrump#ExGOP
Lonestarmomcom,famly twitter acct/ Education Advocate/Mom, Bulldogs, photography, sometimes politics. A leader doesn't belittle others. #GOP voting down ballot #NeverTrump
johnblakeart,Erstwhile babysitter of criminal aliens from the Reconquista ★ Not keen on authoritarian nanny statists & SJWs ★ #2A ★ Mountain man ★ Folk artist ★ Chappy ✞ ن ✡
BallInsurance,Florida Property & Casualty Agency Offering Homeowners, Business Owners and Business Liability! (386) 957-5830
FernLargok,
PatJohnson_111,Backup acct to @_PatJohnson_ 
#ProLife, Life, & (#2A) Protection of Life, Liberty  Liberty Pursuit of Happiness #Stand4Life #Tcot #CCOT #LNYHBT
Kimicharm,God is my Refuge and strength. Child of Jesus, Proud Wife to USAF Desert Storm Vet, Mother, Grandmother, Nurse and  Homemaker. LET GO AND LET GOD!
#cruzcrew
RepGoodlatte,Proudly representing the Sixth Congressional District of Virginia in the U.S. House of Representatives. Chair of @HouseJudiciary. #VA06
DocWashburn,Talk show host KARN/Little Rock. Here's how I create appointment listening: https://t.co/7nyCQv0EoU
newconservny,Informed American who believes that the Democrat party has been hijacked by the communist party USA.  The American spirit will not be broken.  United We Stand.
jsbuis,Christian.Husband.Conservative.Old Guard Reagan Republican: Kentucky #PJNET #tcot #ccot #prolife #2A
SkidWillie,The best possible social program is a job - Ronald Reagan.   Shook hands with Charlton Heston.  #tcot #Trump2016 #MAGA
LadyLNorth,Christian. Conservative. Mom. Wife of Retired USN CPO. #RockChalkJayhawk #ForeverRoyal.
SouthVinie,Very Cranky Independent Conservative tired of bs and stupid people. Proud Tam and followed by Tammy Bruce and other fellow travelers. Proud kafir.
SophiesMom64,God doesn't want us to become doormats. He wants us to be bold and truthful in His name.  TCN
cynbel,Architect; Constitutional Conservative; daughter of USN aviator; Jew; CHL; 3 Boston Terriers; LSU alum; spouse @jefflegal. #WAR #Cruz #alwaysconstitution
Winston_Truth,Truth - Nothing but the Truth so help me GOD! Paleo-C3 (Christian, Conservative, Constitution); Army vet, Korea, Air Assault Sky Soldier, Genesis 12:2-3
Jewels_Green,just another pro-life Catholic convert football-loving bibliophile with 4 tattoos, 3 kids, 2 degrees, and 1 regretful past in the abortion industry +AMDG+
Buttlerfly01,Concern Voter, that's why I Vote for Ron Paul.
writeradpoole,Swordsman, Scholar, and Scribe for the King of Kings
NoOnePatriot,
BostonBridget,Tweets from the tree-hugging, Volvo-driving, cat-owning vegetarian engineer/lawyer wing of the conservative movement.
MediaJuggernaut,Pragmatic Conservative w/Libertarian Leanings. Satire Enthusiast. Deeply Enjoy Mocking Liberals, Walks On The Beach, But Mostly Mocking Liberals.  WOO-PIG-SOOIE
ChatChooChoo,Love life and laughter, I am a fun person who loves others, and born again Christian,  and saving our country.
SamThiessen,Alternative Energy Business. West Point '73, University of Iowa MBA '79. Retired Army. http://t.co/Qu02P4J2Of
TheRevMikeS,Humble servant of the LORD. Retweet≠endorsement. Prayer is home base. #PrayTogether #CCOT #WeAreN #PJNET #PRAY
boocatbutterbee,I loathe gardening, beach-combing, sewing, knitting, Steampunk goth culture, Yorkshire, cricket, and studying Italian.
Buttercup_ca,A quilter,  a baker,  a gardener and a Mother.  Concerned about losing our way of life life,  liberty and pursuit of happiness.  #Cruz2016
GeorgeEliseo,Former San Diego PD. My 1st novel, Altering Course on Amazon: https://t.co/p7LuUMFedW Snarky. Humorous. Armed and Gregarious. The 1A if not for the 2A.
aubrynathome,Is 59:19 Standardbearer #ccot #tcot #PJNET #Israel #2A #1A #patriot #LEO #CruzCrew #15Rules #NeverTrump #DelegateRevolt  #RAT No Christian SupportsTrump
SilverSummerSun,Wife, mother, grandmother. Ex-GOP  Not my circus, not my monkeys. ~Polish proverb
Sir_Templar,Conservative,  IT Professional, Knights Templar, Christian,  Philosopher, Seeker of Wisdom in Faith and History.
wambam5361,Retired wise old owl married over 35 year. Best friend a choc lab Hershey. Like him more than most people!These r my opinions! God family, country! i followback
Damn_Lucky,Husband, Father, Marine
I refuse to let the Progressives destroy the country I love #HeartLand N.W. Iowa #RedNationRising
diana_hester,Degree and training in marketing that has traversed 3 decades of change staying on cutting edge!  Entrepreneur at heart.  Social media rocks!
DiamondbackMac,The problem with the world is that the intelligent people are full of doubts while the stupid ones are full of confidence. To God, Country, and Corps, Semper Fi
Metaomnia,Liberty, defending the republic and the Constitution, economics, history, culture, & life. Support the Article 5 Convention of the States to save our republic.
DustyJuhl,@IowaStateU grad, IT Software Tester, former @IAC4L State Coordinator, @DAQAA_com VP/Treasurer, @DallasCowboys fan, political junkie #TCOT #TLOT #MolonLabe
NorwoodTeaParty,I'm an independent CAT (Conservative Against Trump). Deal with it. Trump and Hillary morons, please do not follow me.
JanaWill33,Proud wife and proud mother to the two most beautiful and precious girls; Assistant District Attorney; #NeverTrump
mossbackjr,BS Dietics and Nutrition Lamar University.MPHN student at Liberty University.
RomCsar,Practicing Christian, Reagan Conservative, #TeaParty #Cruz2016 #MarkLevin #MMA  #DOGS  (1 Timóteo 2:15) Eu sou um cristão praticante #BeloHorizonte
yccousar,I am a real estate/business marketing consultant dedicated and committed to making a difference in my client's business marketing experiences.
HRacist,Human supremacist among Earth's lesser creatures; rightful heir of #sovereignty by Laws of Nature & Nature's God; slave in globalist #Agenda21 plot.
AngelesMC_NY,
svkenney,Necessity is the plea for every infringement of human freedom: it is the argument of tyrants; it is the creed of slaves.
aeronautic1,Son of Texas. Fiscal Conservative. ATP Pilot,USCG Veteran. NRA Life Member. ABATE Life Member. BPOE American Legion. PGRider. Eighth Generation American [c1740]
realWayneAdler,Student of life, believer in the God-given rights of life, liberty, and the pursuit of happiness. Electronics technician, amateur photographer.
rcaster,Reformed Capitol Hill staffer. Digital campaign gun-for-hire. Hamiltonian apologist. Straussian enthusiast. #Texan in #Florida for 2016. #MarcoRubio
davidtark,Pastor @thefirstfam: FBC Orange Park - @gamedaychurch - The Creek - Island Church - @battlereadymen & @realstuffclubs.
minsalbooks,
cgowlvUSA,CA TeaParty Constitutional Conservative ★@TedCruz #CruzCrew https://t.co/t45SBAJjsO⍟@SenTedCruz https://t.co/qJcp9d09tb ★ https://t.co/u0MFSy4Dar
WI4Cruz,Wisconsin for @TedCruz • A 100% volunteer, grassroots account! • Join the #CruzCrew and spread the word:
Richzeoli,I talk for a living. 3-6pm on @Talkradio1210 https://t.co/Rgngb8mPfh
Infidelzfun,Dad, husband, avid offroader, & all around EVIL CON$ERVATIVE - Founding member of @theredneckCC - Followed by @tedcruz & @DLoesch ~ PROUD TEXAN ~
lollauralane,Laura is dedicated to delivering outstanding service and results which your family, your friends, and you can count on when selling your home.
BL_Abba,Grumpy old woman, conservatarian. #NeverTrump #NeverHillary #ExGOP  #StandWithIsrael  #UnbornLivesMatter
TxDan_Gonzalez,Proud father. Native Austinite. Strategic Advisor. 20 years experience in Texas Politics. Working for a better Texas. Legis. Dir. for Texas Assoc. of REALTORS
jamescchandler,A follower of Jesus, a husband, a father, a wannabe scholar, theologian, and writer. http://t.co/yNvaARZNsK
nw_patriot,I am a US Constitution loving veteran who is American by birth and Conservative by choice. NRA member. Concealed Carry Advocate. Reagan Conservative.
SayethTheOrc,I muse about foreign policy, domestic intrigue, good wars and bad politics.  I also kill elves.
ChrizDDv3,Citizen Civil Rights Activist, Liberty is the Ultimate Civil Right! Dad, Purdue U #boilerup, USAF, #MLSCC=Mark Levin Show Constitutional Conservative #CruzCrew
Truthnaut,Former republican. Independent CAT
donnasfineart,I am what I am today for what I believed about myself yesterday. I will be tomorrow, what I believe about myself right now #DreamBig your #ideas today
JBHarvelle,Shining a light against the forces of darkness. Fight the good fight, or get out of the way! #Catholic #Conservative #1A #2A #1M1W #prolife #CruzCrew #tcot
_4PeteSake,Sports fan. News/politics junkie. Conservative. Music lover. #followback #unfollowback #NeverTrump
54Constitution,★ Anyone who trades liberty for security deserves neither liberty nor security. ★
GerryDales,Official adjudicator of #EvergreenTweets. 
The link explains what this is about.
SOSUSA2016,Conservative  #TCOT #TedCruz2016  #WriteInCRUZ #ConventionOfTheStates Followed by @TedCruz @SenTedCruz
