isaiahsvision,Unapologetic Lover of #JesusChrist, the #HolyWordofGod, my #Family, the #Church, the #USA , the #Constitution, the #2A. #MolonLabe, Still #NeverTrumpOrHillary
Republikim1,Conservative. Christian. Entertainment Industry. Love USA, Military, Vets, Israel, Stray Kids/Animals, Creativity, Brilliant U.S. Constitution, 1A, 2A. #TedCruz
njdeluca,Social Media/Community Manager.  Love politics, motorcycles, N.E. Patriots & helping others. Comments expressed are my own.
Lindydj,Christian Conservative Blessed to live in Texas. Love our great military men & women. 82nd-Go America! #NeverGOP #NeverTrump
RichardJSunkle,Unapologetic conservative too old for the crap. Strict Constitutionalist #CruzCrew #NeverTrump #ConstitutionForever    #FlyoverCountryValues
piercearrow33,father, widower, systems engineer, #followback, unweird, great guy, golfer, investor, @NBA, @NFL, @MLB, RTs = endorsement. Aiming for 500k followers
daisygardnerwo1,
AndreaNRuth,I am better than my tweets. PoliSci/History/Econ enthusiast. Pro-Life. #NeverTrump. | Host @FarByondBeltway | Co-host #TheContrarians & @CinematicSnobs
grandmadollar,
cigarmike,Christian, lover of fine cigars, The Beautiful City of Memphis, St. Louis Cardinals, Memphis Grizzlies, fine books, and fine conversation.
PatJohnson_9,Backup acct to @_PatJohnson_ 
#ProLife, Life, & (#2A) Protection of Life, Liberty  Liberty Pursuit of Happiness #Stand4Life #Tcot #CCOT #LNYHBT
BibChr,Church: https://t.co/cUyNPIaHq7; Author page: https://t.co/8m7yTkqzIG.  Mostly respond to intelligent tweets from FOLLOWERS. Self-verified daily.
terresamonroe,I am a conservative Christian and my blog is http://t.co/IdkjT2yckK. We cover politics, terrorism and the government - we research progressives.
Briiiitt_,Co-heir with Christ, WT Student, avocado enthusiast, 2009 'Rock Paper Scissors' champion, mediocre writer
elaina426,Messy hair. Thirsty heart. Writer. Love sentence fragments. Fond of Don Henley & pine trees. Jesus. Wine. My dog. Not necessarily in that order. Opinions mine.
RichardDaleT,Libertarian, socially moderate unapologetic #2A supporter. Member of LPR Class of 2016. My Tweets and RTs are my own. #copolitics #coleg
lilindian,Christian - Conservative - Believer in Constitution.
PatJohnson_4,Backup acct to @_PatJohnson_ 
#ProLife, Life, & (#2A) Protection of Life, Liberty  Liberty Pursuit of Happiness #Stand4Life #Tcot #CCOT #LNYHBT
advchaser,Libertarian seeking the restoration of American Liberty and Sanity!  Liberalism is a mental disease!  ΜΟΛΩΝ ΛΑΒΕ! #1A #2A #Const #III% #OiP
DanielAlStevens,I am a fitness enthusiast/adventurer and a generally nice guy. #Conservatarian
SalenaLeePotter,Mom, World's best kisser of boo-boo's, Marriage and family therapist, PhD-C, Conservative, Objectivist, Runner, and all that jazz.
sictransitvitam,event transportation geek . . . stand-up philosopher
mexseiko,Christian, Conservative.
Nicki_F,Army vet * Immigrant * Sometimes writer * Don't care about your race, gender, religion, sexual orientation, or color * Friend of freedom = friend of mine
DavidLWhite1,Conservative~Curmudgeon #2a #PJNET #WeStandWithScottWalker #NEVERTRUMP
#NoTerroristsInWisconsin
#RecallRINORyan
#TedCruz2016
PLBAndrews,Laissez-faire Thinker! #TermLimits. Comments & Opinions posted are my own & do not represent my employer or any organization.
sizzlesride,Gun totin' #2A #NRA, CHL Licensed, FREEDOM DEFENDING, Smaller Gov't Demanding, LADY PATRIOT #PJNET #MakeDCListen DEFEAT #WashingtonCartel #CruzCrew #ChooseCruz
t2hicks,Christian, devoted husband, doting father, CFP Practitioner in Cary & Southern Pines, past Chairman of @durhamgop now Board member for @JohnLockeNC #Blessed.
dccoggin,
warriorwoman91,I'm a Christian, conservative, highly emotional, mildly sarcastic, very logical, slightly crazy person w/a dash of stoicism here and there.
MikeRTrice,Dad, husband, lecturer at MIT in Writing, Rhetoric, & Professional Communication. Written words for SXSW, Dragon Magazine, The Mary Sue, Google Scholar, Apple.
JONWEXFORD,emerging author #tcot
xxxmoraldk,Want to live in a nation with the right to moral law,Like baseball,golf and the TRUTH.Defender of the Constitution,Patriot.GO CRUZ! and  USA! Support military!!
PRoachND,An opinionated tax attorney, aiming for satire and (mostly unsuccessfully) trying to avoid pontificating.
Jantxnc,Texan in NC, Mom, Nana, Dallas Cowboys, ProLife, ProGod, ProGuns, Pro Israel, #Cruzcrew. NO LIST PLEASE! EX-GOP NOW..
Shaughn_A,Created, co-planned & co-executed NPR sting w/@SimonTemplarPV posing as a Muslim Brotherhood front group. Tweets are MY opinion, RTs are just that, RTs :|
davidgaw,Technophilic, cat-owning conserva-libertarian, world traveler, and trouble-maker--not necessarily in that order.
PounderFile,President, Definers Public Affairs and President, America Rising LLC
CheapSeats411,Award winning sports editor/writer/photo/columnist looking for work/back in Chitown after 13yrs/husband/dad of 2 teen girls #WPS #CWS #BEARS #BULLS #HAWKS
Jbrock130,CONSERVATIVE, CHRISTIAN, GUN & BIBLE CLINGING TEXAN.PLANTING MY FEET ACROSS THE LINE!! I STAND WITH TED CRUZ INFIDEL#TEAPARTY#USA#LIFE-NRA#GOA#TSRA#MOLONLABE#
do6986,Markets, Giants, Lacrosse, Mets, and my own special brand of No Justice No Peace.  What would Magnum do?
hdestes43,Born in Texas-Raised in Oklahoma-Retired USAF. Christian Conservative.
FredWMahe,• Dad • Husband • Colo native and resident • Manhattan 13 amazing yrs •
United_Ignited,Standing Up For God and Country against a Tyrannical Government!! #wtpuai #tcot #FFR
debrakcarey,A long habit of not thinking a thing wrong gives it a superficial appearance of being right. - Thomas Paine
cjiausa,Bio:https://t.co/vUeMSfNUD9 
en español-  https://t.co/HofOBEh619
DeborahLovesUSA,Love Music, Art, Cooking, Learning New Things, Truth, Animals, Jehovah God, Jesus, & My Country To Remain Free.♥ CONSERVATIVE / REPUBLICAN @TedCruz @SenTedCruz
Youcanvote,Right Conservative Republican Constitutionalist Libertarian. Not Left Liberal- Anarchist Fascist Socialist Communist Marxist Extremest/   #tcot #NRA #teaparty
mercenarygrip,Need a laugh?  Want to vent?  Stop by http://t.co/dFyYKOMV5e & you won't be disappointed.  For Adults 18+ ONLY!!  You have been warned (and invited!)
nnielsenphoto,Artistic photography, video & graphic design are what I do. Jesus, family, church, truth, drums & bikes are all part of who I am.
sjk1776,Constitutional Conservative | Followed by @David_Gergen | #AlwaysTedCruz | #NeverHillary | RIP Cecilia
1996Oakhill,Wife, Mother, Grandmother, Conservative. I'm not a groupie.  Only follow followers...and not all of them!
#WkUpAmer
6thgentexan,If #2A is nullified, whatever remains of the other amendments will vanish. Election 2016 is a dumpster fire. #CruzCrew
TrentIsaac,Imagi - imagination magician. Day job - district directing for #txlege Rep. @MollyWhiteTX. Former night job - editing @Confettifall (#vss & #TwitterFiction Mag)
BBUMH,American Citizen.
consptheory77,#Orthodox #Christian; #news/#politics aggregator; #paleoconservative; #conspiracy theorist; I ♥ #movies; #NeverTrump
TheMindOfClint,The Official Twitter page for The Mind Of Clint conservative opinion piece. Read in over 10 countries. New on FB!! https://t.co/mMrJqV0GGW
rposey70,Husband to the most amazing lady April Posey and father to 4 wonderful children. Justine Tiffany Justus Lydia and Papa to a beautiful granddaughter Elaina
bcwilliams92,Husband, Father, Real Estate Investor, Christian, Israel, Conservative, Constitution, Freedom Lover, news junkie, Politics, Current River, Kansas Basketball
jeffperi,Love Entrepreneurship! From Hollywood to DC, CPG and Social Media to Cyber Warfare. Conservationist, small l Libertarian :), Classical Liberal and loves Israel.
Travis73,Christ follower. Husband of one woman. Father of three young men. Pastor. Former 11B. Hoosier born but gone to Texas.
DiscipleOfLowd,ṭһє ȏғғıċıѧʟ ṭẇıṭṭєя һѧṅԀʟє ғȏя Ԁıṡċıƿʟє ȏғ ʟȏẇԀ...
PatriotWriter,Humorist moonlighting as a writer. Daughter of the American Revolution. Thomas Jefferson is my main squeeze. Chose the red pill in 2007. L Bar V
acb4values,Proud Christian Constitutional American, Grateful wife of 26 yrs, Honored homeschool Mom of 4, Cowboy fan & Professional Counselor. Blocked by Cecile Richards!!
saharris8,
BonnieBarker18,Christian,love my guy,my mom,enjoy baking,smiling,humor,beach, good tunes,and my days off. Pray for america.I wont follow u if we have nothing in common.
the_dww,God fearing, Jesus loving, family focused, conservative American....Husband, Dad, and Grandpa....USAF, Ret....Ramblin' Wreck from Ga Tech....God Bless America
DarrRenee,
kateofkatehall1,Lawyer; fan of Shakespeare, classical music, beauty, and black labs; my book, The Ghosts of Jubilee, is now available on Amazon!
ajbrzski,Dad,Husband,America,Constitution,Texas,Caribbean,Rock,Bourbon,Wine, Outdoors,'Ron Swanson' Libertarian,Investing,Always Researching Business Opportunities
tbrasuell,Christian, husband, father, Constitutionalist. Patrick Henry descendant. Happy Warrior #CruzCrew List=Block
iamdce2,Follower of Jesus Christ, married to CindyLooHoo, Chazbo & Chloe' are God's gifts..Kairos..Laus Deo..Opinions are my own
peakwriter,Conservative thinker/writer. Believe in God & Country, and a free America where the govt is the servant of the people & not the other way around.
Jeff_Jacoby,I'm an op-ed columnist at the Boston Globe, a purveyor of refreshing conservative cheer in the midst of a dusty liberal wilderness.
SteveCzonstka,Okaloosa County GOP State Committeeman
peterrough,Foreign Policy, Politics, all things Iowa & Kärnten || Fellow @ Hudson Institute || Tweets are mine || RT ≠ endorsement
mjocnl,Conservative American and Proud Texan
heybriandawson,@Forbes contributing editor. Proud Ohioan. Trying to behave myself.
papa_fenton,I love my Lord Jesus, and my Wife and my kids, We love camping, fishing and boating. Neither n R or a D. I am an American!!!
UtahRattler,Conservative primarily focused on Utah and Davis County Issues.  See blog for more info.
FrontRowSeat42,RTing is merely F.Y.I. ing Agree or Disagree that’s up to you
CommodoreBTC,Vandy grad, Bitcoin believer, #NeverTrump
Nehemiah2_18,Systems entrepreneur, love God, my wife, family, friends, kids and freedom.  #lnyhbt http://t.co/vJiNusuvzw #tcot #tgdn #ccot Psalm_118:8
ToddFeasel,Husband, father, and Christ follower. Pursuing wholeness in body, mind, and spirit. Pursuing holiness in thought, word, and action.
zorekrichards,Constitutional Conservative - Christian -  #NeverTrump     @Media_Notes  @wsf_mississippi @z_mississippi #1A #2A
CraigLMurphy,Conservative political innovator & fierce competitor.You owe it to your philosophy to win. History forgets excuse-makers.Reality hunts those who try to avoid it
Herfarm,For what avail the plough or sail, or land or life, if freedom fail? ~Emerson, Known as Bramblerose Frumblefoot of Bywater. #tcot #teaparty #MAGA #hobbit
ChampionNewsNet,Your source for IL News and Commentary on Education, Pensions and Politics.
BenSmithDC,Comms guy and news junkie. Living the dream in DC. RT is not an endorsement. Views my own. Now @dcexaminer. Former CARLY for America, TheDC, & DailySignal.
ClariciaQ,
PF83,Christ follower, Wife, Mom, Teacher, Constitutional Conservative
TomLehner,God fearing, Bible Reading, Family loving, Constitution defending, Gun Touting Reagan Conservative, Father Business Owner, Rancher
meces29,Homeschooling housewife, married to the love of my life, Loves travel & being with my kids!
vikingomayor,Soy Mexicano que gusta del arte, de la cultura, la politica; de los buenos amigos. I'm Mexican, who like art, culture, politics; good friends.
SSHS_McAllister,AP/CP Gov/Econ
rednett,Most recently worked as a radio DJ but am now happily retired.  #CruzCrew Check out my blog https://t.co/ftP3g3Iije Christian and Conservative.
GaryShapiro,CEO @CTATech, the leading tech trade association and producer of @CES. Proud member of @imovement. Author of Ninja Innovation and The Comeback.
snarkyboomer,Political: Constitutionalists, lean to conservative.  #TCOT. Believe in the right to defend. http://t.co/Vz4bhSDn2D
shockvote,Voting in America is Flatlining, time to Shock the Vote back to life again.
RichCounts,Making it happen. Account Director at MediaDC, @ItsFirstFriday co-director, college & pro hoops fan. Tulane alum. St. Thomas, #USVI / #NOLA / DC
MikeMiller1958,I have nothing to say, so listen up. #Christian #Cardinals #Dylan #running RT or follow ≠ Endorsement. All views expressed are my own.
GodSaveAmerica1,Jesus. Ga Tech, Harvard Law. #LNYHBT Go Trump, Baby!! In God We Trust, but trolls will be blocked. No ad hominem attacks please.
JFitz1104,Destined to be a sign of contradiction.
ShellyZinke,California Small Business-Farming,Republican/Moderate Independent-Christian Family/Retired Education/RN-Travel/Music/Outdoor Recreation, #CruzCrew
SMUMustangAlum,[N]ever give in... except to convictions of honor.... Never yield to force... to the apparently overwhelming might of the enemy. 

Sir Winston Churchill
moxiemom,
silverbird458,Married shortterm missionary, freelance writer lives among strawberryfields. #cruzcrew, #HeritageActionSentinel, fired by #NeverTrump #ccot #PJNET
RockwallPatriot,Psalm 11:3  If the foundations are destroyed, what can the righteous do?
Nickhoeffler,Patriot who loves my country & home state! I respect those that served our country--THANK YOU! Married 2 my best friend ~no children.
felix_sanchez,Politics/Entertainment through a Latino lens; co-founder National Hispanic Foundation for the Arts with Jimmy Smits, Sonia Braga, Esai Morales and Merel Julia
carmichaelrobin,Happily married, two wonderful sons 23 and 21. i love Jesus!
LeBonTravel,Le Bon Travel & Culture focuses on cultural tourism: opera, theater, art, books, music, movies, food and wine.
samwebb1876,Family Man. Churchman. Attorney. Associate Fellow, @ERLC. @TAMU & @TTU_Law Alum.
RHSterling,Freelance writer, storyteller, author and web content optimization expert.  I write fact based, pragmatic content for the web - not hype.
raok62,
gvhorn1,
BoSnerdley,Bo Snerdley the Rush Limbaugh show a/k/a The Official Obama Criticizer
kenntilus,Believer | Husband | Dad | Encourager | Writer | Photographer | Finn | Cowboy | 
'All things are possible if you believe'
#Believe
PatJohnson_2,Backup acct to @_PatJohnson_ 
#ProLife, Life, & (#2A) Protection of Life, Liberty  Liberty Pursuit of Happiness #Stand4Life #Tcot #CCOT #LNYHBT
EricAmey2,Conservative / BlockObamaPolicies / SupportIsrael / My News source: http://t.co/gXUsGl1JKj TheBlaze is also on Dish, 80+ Cable providers & Roku streaming player
yovinny,Ad guy (regular and political), novelist, crapcan car racer http://t.co/8y4vKi6vEc
Burt_NWAS,During times of universal deceit, telling the truth becomes a revolutionary act. -- Orwell
Protect2ndA,Lonely Traveler in this Universe
HectorVote,AMERICAN, #REALTOR #TCOT #Conservative, #Baseball lover, #Catholic #ChulaVista #SanDiego #California #CruzCrew #CruzDelegate -tweets are my own-
ttredraider,Oil&Gas; Ted Cruz in 2016; My English Bulldog Daisy; Music~30 Sec to Mars, MCR, AFI. Tebow, UF Gators, Texas Tech. Peaky Blinders, & The NRA. Ex-GOP.
razshafer,Christian, Texan, Conservative, Entrepreneur, Politico. Sigma Chi, Singer/Song-writer, Cigar/Fly-fishing/2nd amdmt fan.
scconservative9,
brandt_mike,The folks that wrote US Constitution knew what they were doing. Leave me alone & stop taking my $! #NRA & #GunOwners Of America Life Member #ArticleV #Cruz2016
Scgator1414,Spoonfed too many RINOs in the past. Will NEVER support 2016's version in trump. WILL vote Cruz, no matter what.
Pallamus,Constitutional Conservative, Roman Catholic, and a believer in Chivalry. '94 Poli Sci Shielded by God Psalm 91
mickrsmith,Husband, Father, Financial Advisor, Gospeler, Counselor, Network Marketer with ASEA, Vietnam Era Veteran, Outlaw and/or Rogue (depending on who you ask).
granitewinger,NH small business person, father, husband, diver. Proud Citizen ashamed my govt is tracking my cell phone traffic and emails. What has happened to the USA?
daleevans,I'm an extremely private person. What am I doing here???!!
JohnEkdahl,Professional virtue-signaller. Was a secret SJW liberal all along, apparently.
EverettShauger,Christian, Patriot, Conservative, Loving Faithful Husband, Proud Father Of Three, Pro 2nd Admendment, Anything's Possible With God
WebbChad,Man of many hats.
WayneSlater,Political Writer Emeritus the Dallas Morning News, bestselling author of Bush's Brain. One of the authors of the Port Huron Statement, maybe. News is conflict.
fitzelizabeth,Catholic, Conservative. Love My Country, My Guns, My Liberty,and Wide Open Spaces.
RepJoeCarr,Past member of the Tennessee General Assembly & candidate for the U.S. Congress...stand firm
KeruxonJCJ,
ChasFlemming,Christ-Follower, Husband, Father, Friend, Pastor-Teacher, writer. Fascinated by politics, public issues, communication, and leadership. #NeverTrump #NeverTrump7
HonkusMcGhee,So-Cal conservative+Oregon native+attorney+independent thinker but fan of populist lingo
fuzislippers,Politics-I like mine common sense, conservative, and Constitutional. Write at Legal Insurrection. TEA Party Hobbit and Wacko Bird
ConservativeHav,Fully #Conservative. Unquestionably #Christian. Unflinchingly #Patriotic. We engage with #TCOT, #CCOT, #2A, #ProLife, #ProIsrael, and #PJNET. #ChooseCruz!
RightEyeGuy,Conservatarian Motorcycle Chocolate #savedbygrace #teaparty #NRA #TCOT #2A #indiana #cos #molonlabe #CruzCrew Eph 2:8. I block 'increase follower' accounts.
jato791,Baltimorean by birth & attitude, hon. Owner of Summerhill Stitchery and a Greyhound Puppy Fairy. Navy wife...  retired!
m_peterson93,Political Science graduate from Gardner-Webb U. Law student at the University of Louisville and defender of our Civil Liberties and the Constitution
spulliam,@WashingtonPost religion reporter, covering how faith intersects with politics, culture and...everything. Amateur violist, cook, board gamer. spulliam@gmail.com
ScamPumpers,We are following the stock promotion BS of #pennystock scammers all over the US and Canada. #Finra, #SEC, #pennystocks, #NASDAQ, #NYSE
PatJonsonBackup,Backup acct to @_PatJohnson_ 
#ProLife, Life, & (#2A) Protection of Life, Liberty  Liberty Pursuit of Happiness #Stand4Life #Tcot #CCOT #LNYHBT
JustDaveZA,Constitutional Conservative | Pro Israel | Pro Life | Pro Gun and I carry ... all day | #PJNET #TCOT #CCOT #NeverHillary #CruzCrew #BlueLivesMatter #Patriot
conens46,Intercessor, resistor, wrestler, I bind and loose... lover, worshiper, praiser of God, Holy Spirit led prayer warrior.
preventandcure,Focused on the Prevention and Cure of Cancer.  Looking for natural cures for cancer, diabetes, heart. Christian, witnessed God's miracle healings.
NancyLRogers1,Conservative Christian for #TedCruz2016 #CruzCrew  #ChooseCruz #AlwaysCruz #NeverTrump
ScrawnyBeast,ChristianBaptistHusbandFatherEngineerMathguyJugglerBoardgamerAmetureprogrammerYouthleader
FreeAllCaptives,Eating candy corn and praying to love God and change the world with love. Also a mad Conservative Republican Patriot. Who Tweets a lot. #TeaParty
loeffler,Love dynamic languages. Gave up Java for Ruby to return to Lisp roots.  Swiftly adopting Swift.
Melita1964,Jamaican-American Independent Conservative #WriteInCruz #VoteTedCruz #1A #2A #NeverTrumpClinton #CUFI #StandWithISRAEL https://t.co/j9f6aaBnM4
Mrs_Coder,mrs_coder@zoho.com
Momofonly3,Conservative, #Catholic mom; values God, family, USA. Sm Biz owner #NFIB ♦ #ProLife  Member of: @AsAMomOrg ♦ #WSFT ♦ #NRA.   GO #HUSKERS
PatriotGinger,Nana of 6.Character Matters #Prolife,#2A,Lifetime #NRA, #ProIsrael #CruzCrew #Bengahzi, 
Honored @TedCruz & @SenTedCruz follow me.
Stevens_NH,Live in NH, work in DC. Tweets are my own.
CapitaLiszt,Proud rhetorical soldier in the Dick Cheney/Marco Rubio  principled conservative Republican batallion to help defeat HRC & save our Republic
catblackfrazier,God Bless Texas. #CruzCrew
GeorgiaLogCabin,You don't have to be from Georgia to follow @GeorgiaLogCabin. News for gay, lesbian, straight, conservative, libertarian, independent or moderate Republicans.
MtnrMS,Vigilia pretium libertatis. 
Opinions are my own.
BADBOZO,
Alumni4Liberty,AFL is a project of @SFLiberty and @YALiberty that provides a way for alumni dedicated to liberty remain involved in supporting the student movement.
AliceD0N0VAN,Christ follower /Constitutional Conservative. Came to Twitter in response to Ted Cruz 21 hrs. / #Benghazi / #tcot / #cruzcrew / #lnyhbt
jeffallen1987,Pastor, Radical Religious Right, Senior Editor for http://t.co/UgjcZRnvtH; Author of Shattering Liberal Lies, available at: http://t.co/4rwjfd0Csv
lynn_lwrightpcd,Christian conservative mother of 4 boys, wife of 1 great man, nurse and all around crazy woman.
Gary_Batey,Fortune 50 exec, biz owner, entrepreneur, pilot, pets,  ppl. Snapchat garybatey Instagram Gary_Batey https://t.co/m9vlrTmkCl https://t.co/umv4ee0jtT
gangofme,Follower of The Way, and His name is Jesus. Building strong men of character and faith to lead strong families and communities.
concolj,Student, Catholic, #CruzCrew
autodog5150,Mom, wife, animal lover, retired veterinarian, constitutional conservative/libertarian, strong supporter 2Amend, stuck in progressive CA
IshYimini,Foreign Policy, NatSec, CT, Diplomacy, & Politics. https://t.co/uFk2l6eYfi
TheMadHessian,Westsylvania Bureau Chief, #TGDN, Mechanical Engineering Grad-Leed AP, Scientist, #Pirates, #Steelers, #Penguins, #PITT, Onward #ChristianSoldiers
janalalawrence,Mother, reader, teacher, artist, analyzer, student. I love music, laughing, and being right - not necessarily in that order.
josephdeluna3,Vietnam Veteran, TEA Party Participant, Conservative  Republican, RINO Hunter, DemocRat Hater! Voted For Goldwater, Reagan And Bushes! Romney's Next!
dlb703,Conservative Virginian enjoying retirement w @mrs703. My life is loosely based on a true story. Glimpse some of it here: https://t.co/nx9UgDZqts
bobbymarkham,Husband to Rebecca, father to five gifts of God, and Pastor to Students and Young Adults at Vilonia's First Baptist Church.
ColdWarBowTie,Friend, frenemy of wise mens’ sartorial kit: Nitze’s pocket square, Kennan’s cufflinks, Acheson’s mustache brush, Gromyko’s homburg, both Dulles’ wire rim specs
uncommentari,Part Hillbilly. Part Viking. Broken. Christ is my fix.
boblongATX,Apostolic Overseer-Rally Call Min. Bible Believer. Church Reformer. Culture Shaper. Movement Starter.  Apostolic Mentor.   Constitutional Conservative
officialOKGOP,The official Twitter feed of the Oklahoma Republican Party. Advancing prosperity, liberty, and freedom for all Oklahomans. RTs ≠ endorsements.
nancynance,Hip Conservative and VERY PROUD American, Proud Jewess, Pro Israel, Animal Lover
johnestrada,U.S. Military Veteran, Small Business Owner, Citizen Advocate, Family Man, and God Bless this journey!
DrewDBrandt,Product Concern Engineer @ Ford Motor, Beautiful Wife, Christian Reaganite Love Fast Boats/Cars & Guns Diagnosed w/MS (Multiple Sclerosis) 2000
PatriotJackiB,A Jewish American Patriot, Mom & breast cancer survivor, whose support for the US and Israel is as strong as my opinions! #ExGOP
SBSportsDiva,Beware,I swear a lot! NRA Member. Storage Wars Super Fan. Pro-USA pro-Military #NoKillary2016 #NeverTrump #CruzinTillTheEnd Cruz Delegate for California.
Antagoniste_net,Deep behind enemy lines!
LibertyNow10,Facts can be opinions but opinions are not always facts Lists = Block! #Cruz
Followed by Janine Stange @THEANTHEMGIRL
hirschA8720,Never give up! Be persistent and determined in everything. I Love God-Family-Country-Dogs-Guns-Music-Fitness-Clean Living..etc. #TedCruz #NeverTrumpEVER
AdamBaldwin,Who of you by worrying can add a single hour to his life?
DrActorKJ,Actor. Star of feature film Coming Home, December '16. Doctor of Pharmacy. Former contributor Breitbart's Big Hollywood. Packers and Badgers. Opinions are mine!
LibraryTchr,Conservative, Researcher, Pro Life, Small Government Supporter
Scott_Spiegel,Political junkie and market researcher
SD_Zach,Mechanical engineer. Certified Solidworks Pro. #cswp #3dprinting
mtsgun,918-423-7500 We carry Glock, Sig Sauer, S&W, HK, FN, Springfield, Daniel Defense, Beretta, IWI, Barrett, Bushmaster, Armalite, Colt and many more.
RJCknox,I am an American Conservative, a Classical Liberal, a Radical Libertatian and sovereign of my own conscious. I am a God-fearing American.
AuctionRinger,List Auctions, Get a Web-site, Online Auction Site, Online Store - Extensive SEO - Get Ranked Higher on #Google, #Bing, #Yahoo, + MORE! #auction #auctioneer
WyattBEarp,CPA. Christian..Friend. Happily married. Supports #Israel & our troops #sot. Fan of @HoustonTexans @Astros fan & @texanscheer
TheCieloFuego,Starry-eyed lover of Jesus. Photographer. Horses. Mom to @_queen_biscuit_ Houston Texans fan. Oh, and I dabble in politics. Voted for Ted Cruz. #NeverTrump
seanmdav,Co-Founder of @FDRLST, data junkie, presidential campaign vet, former chief instigator for Sen. Tom Coburn, Wharton grad.
BJKeesee,Just a plain red blooded christian/ American/conservative.
Commoncents4me,Proud Navy Mom Conservative with a Libertarian slant who appreciates the fine art of sarcasm. #SisterPatriots #Military #2A protects #1A #CruzCrew
AMAction,We mobilize and organize grassroots conservatives in support of leaders who favor limited government, individual freedom, and the free market.
VRWCTexan,Four decades in international oil & gas industry. (Retired)  Hobby: Larruping liberal trolls.   
#USAFVeteran #INTJ #TexasHillCountry
MOM4AmericaPrez,I'm an Adventurer and a really ticked off Grandmother of 3! My grandchildren are being affected by this President & Administration and I WILL NOT TOLERATE IT!
straysauce,Leaning Ex GOP more and more. I think that being a film maker in the vein of Martin Scorsese would be pretty cool.
