JessicaChasmar,Writer @WashTimes | Educator | Instigator | Equal Op Offender
himmelreich78,loves to hunt whitetail and watch tv
FRCdc,Family Research Council is America's premier public policy org advancing faith, family, and freedom in our nation's capital. Led by @Tperkins. #religiousfreedom
WoffordN,Evangelical, Grandma, Mother of 5, Texan, pro-Israel, RN, ɸΒΚ I block haters. #CruzCrew ENG•FRA•ESP
JanellHendren,National Affairs Coordinator, Florida Farm Bureau Federation. Views & opinions expressed here are not endorsed by any entity. DMs = off record.
actlightning,Rabid conservative - Proudly blocked by Valerie Jarrett & Michael Moore. ZERO tolerance for #BranchTrumpidians.  Alinskyites blocked. #NeverTrump
DynnysDerwydd,USAF vet, Libertarian/Conservative, American Mutt, lover of liberty, sarcastic, Objectivist, and just a wee bit crazy (in a fun way).
adamlbourne,Chickasaw city councilman, former Alabama assistant attorney general & University of Alabama graduate. Stand up for Chickasaw!
MaryAnnHoeg,Reagan Conservative,Love my Country,Support our Troops,Christian,Wife, animal lover and food activist! #tcot #TGDN #LNYHBT #PJNET
APetersen4Pres,America needs lower taxes, a limited government, to be fiscally conservative, have a strong military, and closed borders!
5000YrLeap,Driven to Twitter to fight for Liberty, Constitutionalism, & Conservatism against the Fascism of Donald Trump
John_Pavkovich,Retired and loving life.
KatyinIndy,The heart of the wise inclines to the right, the heart of the fool to the left. --Solomon, Ecclesiastes 10:2
RonRoesener,Former GOP Chair of Garfield County.
Former Candidate for Colorado State House District 57
Socialismkills,Tea Party Conservative, Mother of 4 sons. I refuse 2 look back @ this time in our nations history with regret. I will give my all 4 liberty. #Cruz2016 #CruzCrew
BoscoBolt,Praise God, from whom all blessings flow!
juliesnider72,Accountant/Bookkeeper | Proud member of the Grammar Police | Staunch, opinionated Conservative | Mom to a great teenage son & lots of fur-babies |
Dolphieness,Conservative, Red blooded all American USA Patriot, IT consultant, (Systems Analyst/Network Analyst, Computer technology in general)
Tuttray,
AshPratte,Director of Media Relations @better4America1. Commentator. NH Native & @saintanselm grad. Conservative, Pats&Sox. Lover of cowboy boots (tweets=my own thoughts)
DOLORESALANIZ,Raise the standard & leave the rest to God. The Way The Truth & The Life ♡ JESUS ✡ YHWH~YESHUA~ELOHIM~JEHOVAH
jck0514,Constitutional libertarian. Period.   If you support sleazy tRump, don't even follow me!   Solicitations will be blocked.
TXCR,Conservative Roundtable of Texas promotes and advances thoughtful, conservative solutions to the economic challenges facing Texas.
deltaTN,Christian. Catholic. Conservative. 100% Southern. Bookworm. Gardener. Good cook. Fan of Atlanta Braves & Indycar racing.  #IstandwithIsrael #CruzCrew #Cruz2016
ACSpollen,Reagan Republican, Fiscal Conservative. Parrothead. @IndJournal contributor. Rick Perry is my spirit animal. Sarcasm is a terrible thing to waste.
montex_65,AMERICAN.

Personal responsibility advocate. Awnry Sheepdog. Veteran cop. Personal defense trainer/firearm survival skills.
Ron_GriffithsJr,Pennsylvania Native; Penn State Alumnus; Engineer; Three Children; Constitutional Conservative; Advancer of Liberty; Christian; Dont Tread On Me #tcot #TeaParty
Plawrence1206,Just making every day count, hard working and being very loyal!
atemely,lola w/ an iphone, ipad & mac
mharry860,
PrestonHagaman,Obsessed with reading, learning & helping others. I blog because I care.
latikia,Wear the mask long enough and it becomes the face.
nist,Angel investor. Fan of the original open-source operating system: the US Constitution. Member of Altruists for Ayn Rand. Adventist. Married to @cyantist.
Jmbse,Pro God. Pro Truth. Pro Ten Commandments. Pro Life. Pro USA. Pro Israel. Pro Freedom. Pro Vegetarian.
Danno_a_Jyd,Ex-MIGOP delegate, 2 decades a grassroots activist,  destroying liberal #Propaganda 1 #LIE at a time. A leader, not a follower. #TEAParty 'If not you, who?
NewsMediaFacts,Bringing u facts and news that the mainstream media won't report on and other intristing subjects. Conservative #USA  Check out our daily paper
bitternumb,Fun account for someone you've never heard of anyway. Here I can gripe about liberals and not fear their attacks at my work (it happened before). #TCOT
FounderStyle,Born and raised in Northern California. Just another American, trying to recall what too many Americans have forgotten. Provider of political tweets.
lamblock,Married, Catholic Dawg Fan. Stupidity is mocked&blocked. Look for apologies elsewhere. (opinions don't reflect employer &/or where I volunteer) see #2241 @ link
jilevin,Marketing Programs Manager, social media, human rights, politics and news junkie, equality. #UniteBlue
dbc603,Army veteran, Airborne Pathfinder, former SWAT cop, Gunsite alumni, firearms instructor, gun rights blogger, and aikido black belt.
catholiclawyer,Number one draft pick of my parents. RT = re-tweet. I aggressively unfollow back. Politically conservasomething. Anti-Alt Right. #TeamPapist
StrokesofCandor,small business owner, alcohol consumer, transcendental opportunist
USARichC,Conservative, Author, Anti Socialist Anti Progressive ( but I repeat myself ) Crusader looking to restore this Republic!
Paul_Carleton,
JonathanNeerman,Father to Esther and Jonathan, Jr; Husband to @daisydoodle1996; Former Chairman of @dallasgop; #Aggie; @mungerplace
drseanduffy,Friend of God. Husband to @KathyADuffy Prophetic Teacher/Preacher, Psalmist, Writer. Not actually a dr just yet but my wife calls me one.
NewProtectorate,You're not allowed to disagree with me, I'm a victim.
rnfjmf,Christ follower, father, husband, Constitutionalist, Levinite, and a displaced Buckeye fan.
MrJoseSocorro,MS in Organizational Development @ACUedu Student. (Romans 5:3-5) @EvangelUniv Alum & @ORUAlumni.  Born in NJ
MarciaLL,Catholic Mom of 3 Gma of 9 soon. Pro-life, pro-traditional marriage, pro-family. Life - Precious from conception to Natural death. Nurse 40+ yrs.
someluckydog,Retired air traffic controller living the good life in NW Montana! I love photography, traveling, art, and being a wife and Grandma!
EkellyGigi,#ChooseCruz #OnlyCruz #AlwaysCruz
#TedCruz for President of the United States of America
#WriteInCruz

Goodnight America, Wherever You Are
HouseOfColbs,I used to work for a mouse, but when I grow up, I wanna be the Big Cheese.
tonyfro23,My wife,Nolan.Kass.Dakota,mom,our Danes Pepper&Bit, UT Vols. Faith, Hope,Charity,Honor,& PERSONAL RESPONSIBILITY. We remember Durango everyday. #RescueShelters
TheUSNational,¡We Follow Back! United we stand and divided we will fall as a country. ¡Get the News as it Happens!
Sky_Bluez,Political Independent now that Trump is GOP.
JLBelt,Always give 100%, unless you're donating blood. #Christian #Husband #Father #Veteran #USArmy #Infidel #Conservative #Constitutionalist  #FairTax #NRA #2A
DavidYardley,Fighting for lower taxes, less government and more freedom. Heritage Action Sentinel, AFP and FreedomWorks activist. http://t.co/0jvB4AaIkj
TheObsidianOwl,Watcher of Media. Lover of Liberty. God Bless the United States of America. 
RT's do not indicate endorsement.
Muehlhans,Defender of Truth, Freedom and America.  
When the godly are in authority, the people rejoice. But when the wicked are in power, they groan. Proverbs 29:2
farmagoo,Libertarian, Democrat or Republican, the Joke is on US. It's all theater to keep you at odds, and them in control. TRUTH is the new hate speech. #Truth
ianberg,It's Stampede Week
pjfahren,#ORPUW #AFFF76  #PJNET   MOLON LABE                      NO TO Liberals    backup acct @pjf_patriot
Time2BSaved,Christian; Love Israel; Bible study; Jesus is my savior; love to cook; love to bake; love gardening
sarxtweets,Countercultural Culture, #COYS
BigGator5,Conservative. Writer. #TCOT #CCOT #FLACOT #UniteRight #Florida #LakeCountyFL #RealMenHaveBeards #1A #2A #ProLife #ProIsrael #NeverHillary #Isaiah5:20
jcdwms,GOD FAMILY COUNTRY Follower of Christ Huguenots Texan exiled in KS #TedCruz2016 #2A #NRA #ProLife #SoldierMom #Israel #Royals #kubball #KCChiefs
DaveT0076,Red-blooded libertarian family guy who no longer confuses America the Beautiful with the US gov't. Here's hoping for a peaceful restart.
Abbygosh,God-loving news junky; former cancer researcher. Writing is now a hobby but voicing the heart by the letter can influence people and the world we live in.
bodybynance,Contributing Writer for Joe For America;Field Director - Cruz 2016; #CruzCrew #PJNET #GOHTeam  #FLCOT
dickster1961,husband, father of a young man with autism,  conservative with Libertarian leanings, amateur theologian, photographer and blogger,.#PJNET
Shamlind,I am a #conservative Christian that believes in the founding principles and #constitution of the United States of America. And I am not afraid to use them!
FlyFrom,I will shepherd the flock with justice
SiteROI,Editor of and contributor to @georgiapol_com. Conservative leaning Politico. #MillennialWhisperer. Leadership Gwinnett grad. INTJ.
thetrekchurch,Tired of same ol' same ol? Had enough of routine church? So are we! An Apostolic casual fellowship. Life is more than a journey, it's a TREK.
mbhouse,'God save the Constitution.' - Justice Antonin Scalia | I support the Constitutionalists for President/VP: Ted Cruz/Carly Fiorina #CruzCarly2016 #CruzCrew
archivesgirl1,Christ follower//Archivist//Historian//Mom to 3 rescue pups//PRO-2a//PRO-Constitution #DallasStrong
JSWardell,Heritage Action, FreedomWorks, AEI,  ~ Retweet does not = agree. Back-up JSWardell2 ~ https://t.co/c1ujFZgv8M
landj86DeeDee,Trump supporter, White advocate and lover of all peaceful Americans. Truth in a time of deceit is revolutionary. Down the rabbit hole.
trp878,
unalienablerght,Learning from Bible, Spouse, Children, Grandson, Constitution, Mark Levin,Judicial Watch, Hillsdale College, COSProject, ACLJ & you. God's peace BWU
ClayMO4Cruz,We are the #CruzCrew in #ClayCounty #Missouri! Vote for @TedCruz in the #MOPrimary March 15th!
AustinPaul19,Proud RINO. Mercer '18.
vetnoceanside,#Cruz Conservative.  
NOT A REPUBLICAN SELLOUT. #NEVERTRUMP
Stand4Liberty_,The tree of liberty must be refreshed from time to time with the blood of patriots and tyrants~Thomas Jefferson
tamaraj86611162,Distributor for saba ace ,mom , wife, fitness, health food nut, I am a Christian who believes that your victory and all you need is in the cross
lee_ritz,Cheerful-clinger/physician. Will never be a member of NOW, AMA or AARP. RT means you said it better than I could have. #ObamacareIsACancer #DocsForGlocks
awildrose60,Retired RN, Christian, Mother, people lover, gardener, photographer, optimist
WeeklySpoon,The Weekly Spohn is a Conservative political column on https://t.co/OVTCTgc1Kb For 24 hour news updates please follow @CommDigiNews !!
CourageousCPAC,Making hard-hitting ads to elect Courageous Conservatives willing to stand up for what WE believe regardless of who is in the White House
ROCKInTheUSSA,Sadly watching the demise of one of God's greatest gifts to humanity, the United States of America. With both sides almost totally unaware of their loss.
RobertBledsoe76,Tomorrow begins today...
drdavidmcclure,Saved by Grace alone! Internist. Cleveland proud! Go Browns, Tribe, Cavs, Buckeyes and CBJ! Ready to be the next Surgeon General of this great country.
SofieInkpen,libertarian-leaning conservative, Colorado resident, college instructor (English and humanities), poet
EPPolitico,Support political leaders, causes & friends who put progressive change & the people of El Paso first. #ElPaso #latism #UniteBlue
gowest2GA,**In golf as in life it is the follow through that makes the difference.** Proud supporter of: http://t.co/n7pJdbplRS #FairTax #Freedom #PersonalResponsibility
armando135,Please check http://t.co/KI3CpRVk7K
1catherinesiena,AMDG +JMJ+ Charity in all things! I see that the world is rotten because of silence.~St. Catherine of Siena I want to do heaven's work on earth! Pray!
potusCRUZ,Big Hands.  No Water Bottle required.  #CruzCrew #POTUScruz #Cruz2016
mthomp0725,Conservative I believe we need to stand up now and take our country back
J_BrianFleming,#WhoDat #tcot
BobStump,Chair, Phoenix Opera; AZCC; @weeklystandard alum; 'A dashing tuxedoed figure' - AZ Republic; 'The Dennis Miller of Arizona politics' - Marson Media
atlascctx,
SherianBird,Conservative mom, wife, pro-life Catholic farm girl, gardener, genealogy & Veterans
redRIVERhobo,Obama SUCKS... don't doubt me!!!!
JesusIAdoreU,#SavedbyGrace -love Jesus, my family & these blessed United States of America #SoliDeoGloria #MontanaGirl #ConstitutionalConservative #CruzCrew
3ambarbie,Big fan of matchbox twenty, Rob Thomas & Jimmy Fallon. I don't follow back automatically but I will follow if you interact with me. So you might as well say hi!
Laura_PH,Christian conservative. Wife, mother, gamer. Formerly at Hot Air's Green Room & Washington Examiner. #TGDN, #GamerGate #NotYourShield ANTI-#SJW
SpunkyBraun,#Homeschool mom of six - two are US Marines who have my back (and yours) at all times.  They fight pure evil so I have time to fight the #CommonCore and #P-20
JstnCase618,Conservative and proud of it!
NH92276,PROCLAIM LIBERTY THROUGHOUT ALL THE LAND UNTO ALL THE INHABITANTS THEREOF (And #NeverTrump)
BlessedTex,Christian • Constitutional Conservative • Rom 10:9 • Pro-Life-1A-2A-COS-military-LEOs #IStandWithIsrael ✡ #NeverTrump #UnboundDelegates #DumpTrump #ChooseCruz
LittleMsLiberty,Find though she be but little, she is fierce. #Impeach #Revolt #Secede  #TeaParty #MolonLabe #StandWithCruz #IamBreitbart #IamJohnGalt
TexasHotMomma,Conservative Christian TX Momma that is HOT about politics. Happily married @TexasHotDaddy w/ 3 girls & Seth--Labradoodle Ecc 10:2 #JPNET #tcot #Israel #prolife
VaTxn,Texan by blood & birth, then planted in Virginia by the grace of God. More conservative than anybody. Except extremists, of course.
StrazzeriManLLP,Strazzeri Mancini LLP joined forces in 2000. Focused on Estate Litigation & Planning, Wealth Strategies Planning. Founded http://t.co/AYfiTIiofD
ClimateInfidel,Black Profile = Mourning my Country. Husband, Father, & Veteran. Real Conservative (the Federalist Cruz/Lee type). #NeverTrump #NeverHillary
RobertBedo1,
HaugenROC,Writes pithy words on criminal justice reform for @TPPF. Former @EWUEagles microbe farmer turned policy junkie. Springfield Armory aficionado. Opinions my own.
MTGOP,The Montana Republican Party is Montana's leading advocate for smaller government, lower taxes, stronger families, the free market and a stronger nation.
MelvinKassab,#TrusTED #NeverTrump #GodBlessAmerica #GodBlessOurTroops #ConventionOfTheStates #ChooseCruz Let's Reignite The Promise Of America! #CruzCrew
BanGunFreeZones,I support restoring the Unabridged Second Amendment, #2A, Repealing the #16A, Abolishing the IRS. don't send me news feeds or add me to lists. I'll block you.
beachgirlbev,
beth_meredith,#TGDN  I am Christian, and a healthcare worker. I have an awesome family and life. I work hard, play hard, and live each day to the fullest.
moosemangler,Just me
GuySZino,Free markets, End the Fed, pro- Constitution, pro-individual personal and economic freedom.Stop Psych drugging of America.
MaineForCruz,Welcome to the official Maine coalition of Millennials for Ted Cruz, the youth coalition of the Ted Cruz presidential campaign! #TrusTED #CruzCrew #conservative
LeighEPS,Conservative, Political Junkie
PatriotCzar,Honorably Discharged, 50% ABLE with God's Grace, Service Connected Disabled Veteran. FYI - my photo was taken 1982. A lot has changed, but NEVER My Oath to USA!
WintonCapPtnrs,#PrivateEquity, #FamilyOffice, #GlobalMacro, #Greek, #Southerner, #GoGators, #Liberty, small govt, balanced budgets, Thomas Jefferson
jungledad9,Concerned Parent who LEGALLY immigrated to the US
martineza79,SCREAMING EAGLE
Tim_Groseclose,Economics professor at George Mason Univ.  Author of Cheating, Left Turn.  Recovering political scientist.
JusticeBlaze,I Love my God, Children, & Country! I'm a USAF Veteran, Conservative.
davemaney,Founder of Deke Digital and three companies before,  chronicler of the Economic Revolution, father of six, husband of one, and always working to lower my GAA.
ricardobrown,Periodista/Journalist. Retweets and attached links do not necessarily imply endorsement.
LibertyUSA1776,America is the greatest nation on earth! Save it..
GMRench,Faith, sports, and politics.
StridentConserv,#Conservative | #Constitution | Politically Incorrect | Always Right | #PJNET | @RedState | #tcot | Commentaries heard nationally via Salem Radio Network
Red4Liberty,Christian, Conservative, Wife, Mommy of 2 beautiful kids!! FSU grad. Political Junkie. #ProLife #Israel #CruzCrew #NeverTrump
lwintn,Just someone who loves my country and wants it back. #CruzCrew #conservative #CruzToVictory #IranNuclearDeal #alllivesmatter #cruzcares #trustted #gopdebate
Ross_Berry,@NHGOP Executive Director. Avid @NASCAR fan. Fighting for the NH advantage. @UnivOfTheSouth grad
willhaynes,Health IT coder · Fair-weather millennial · @heraldalumni
GarryRSmith,South Carolina House of Representatives, District 27, Greenville County, Republican
AEngelsrud,
AaronHorak,Proud father of a little girl. Liberty-Conservative. National Champions #FightingSioux fan! #NeverTrump #NeverHillary
LatinoUSA,A 2014 @PeabodyAwards winner. Weekly public radio show on @NPR, anchored by @Maria_Hinojosa & produced by @futuromedia. RTs not endorsements.
JesseForWI,Bold Ideas...Conservative Values to Make Wisconsin the BEST!
Anamichele,those who fail to know their history are doomed to repeat it
rhianna,Tarot card reader with interest in Future Options; Flamenco enthusiast; History & Vampire buff; Loves art history & museums; Current Events Junkie
compasscare,Husband of one woman (to be clear) and father of 10 children. President of CompassCare Pregnancy Services.
dalehusar,Retired Pinkerton Detective. Lover of Astroscience. Occasional poet. Retired.
mrscmgroves,married to my favorite man // mama to four little women // following hard after god
kwicgov55,Constitutional conservative-Pro life-Pro 2nd amendment-Christian Support #Cruz #dumptrump Block all Trump Tweets & RT.  #NeverTrump
NoQuarter_Given,My lady @FedUpBecky ΜΟΛΩΝ ΛΑΒΕ #NativeTexan who supports #COSProject Duty-Honor-Country, Veteran U.S. Army
bushido02,MILITANT PATRIOT #PJNET #NRA #tcot #ccot #UniteRight #TDGN #2A #TPFA ,#TPOT,MOLAN LABE,southern Irish,POLITICALLY INCORRECT•love GOD, USA, guns, photography
RogerCBradley,Hubby. Dad. Econ Professor.  In that order.
julito77,Harvard boricua. @futuromedia & @LatinoUSA. Regular @InTheThickShow guest. Avi by @Maria_Hinojosa. @AJStream alum. Opinions mine. Founded @latinorebels. #COYG
z_mississippi,#Mississippi - #CCOT -  #1A #2A  @media_notes @wsf_mississippi  https://t.co/OxD0bX63wr
RightToResist,My goal is to train American Patriots-particularly youth at risk-how to defend their Natural Rights against bullying, without bullying.
txsbaker75,Conservative American for restoring our founding principles. Veteran & patriot. In God We Trust
enbloc30m1,
Right2Liberty,Right-leaning libertarian. Smart-assed broad. Denver Broncos fanatic, Avalanche & Rockies too. Animal lover. Nature Is My Church #PFM #GoBroncos #NeverTrump
reallyasa,
SywakSays,Will work for liberty & Islay whisky | Marketing for @theIHS | Expect tweets on freedom, social change, & music | Opinions are my own & RTs are not endorsements
Paul0451,#Christian; #Constitutionalist #Conservative; US Army Vet.; Followed by @seanhannity - NRA Member; Supporter of Israel; #2A; Μολών λαβέ #ConventionOfStates
AshevilleTeaPty,Tea Party organization for Asheville, NC and surrounding areas. 
We stand for: Individual Rights - Limited Government - Fiscal Responsibility - Free Markets.
IowaWizards,
Mike_Spence,Reagan Republican and Assembly Candidate,  West Covina City Councilman and Chief of Staff to San Bernardino County Supervisor Curt Hagman
SherronU,Student of Life/Arts Aficionado/Ballet Dancer/Choreographer/BizOwner/Health/Politics/Sports/Don't do DMs/Check out FB
Im_ur_hklbry,Conservative ΜΟΛΩΝ ΛΑΒΕ Refer to pinned tweet.
DoubleSarcasm,Helping conservatives and libertarians make a difference.
SerenityNow91,Conservitarian... not Republican. Unaffiliated w/ the Political Parties since 2009
troy_naumu,
CynthiaRoldan,Crime reporter for @TheState | Krav Maga-trained Capoeirista | Yes, I'm still Roldán. I'll judge you for asking why. #YoSoyBoricua
abburgess95,Italian & Irish | Team Jesus | Addicted to Politics | Nerd is mainstream | #NeverHillary
fromthemancave1,Some people stumbled into success while some are purposeful about their success. Me I’ve stumbled more than I care to admit.
CruzCrew2,#CruzCrew God. USA. Constitutional Conservative. Freedom. Liberty. Mark Levin. Golf bum, 3 handicapper. Blocked by Andrea Tantaros #LIghtweight
MBonifacio2,I seek to make the world a better place---one person at a time by serving country, dancing tango, and practicing Tai Chi. #CruzCrew
RufusKings1776,If we must have an enemy at the head of Government, let it be one whom we can oppose.  ―Alexander Hamilton
sarahposner,investigative journalist. religion. politics. lately: @theweek, @rollingstone, @washingtonpost, @huffpostpol, @nytimes. previously: @rdispatches
The_Hiking_Guy,L.A. Born and Bred. Hiking is my favorite game ... So are martial arts, scuba, guns & archery . . . And of course .. Politics.
johngaltfla,Blogger, commentator, hiding in plain sight with thousands of other Galts #NeverTrump #Libertarian
KarenSibertMD,Karen Sibert MD is a physician specializing in general and thoracic anesthesiology, and a columnist who writes about politics and medicine.
1SkepticalChick,Christian, Conservative, Patriot.  Native Texan.
Blues lover.  
Always skeptical, skeptical, skeptical.
Tony_Castro,Order Tony's new book #DiMagandMick and best-seller #MIckeyMantle today at https://t.co/qmd4DZrjgh
trentengland,VP @OCPAthink, host @MiddleGroundTV & @ThinkPatriot, also @SaveOurStates & @liberty_found, formerly @FreedomFdtn. Christian, husband, father, attorney.
manriquehawaii,I own and manage a landscaping company in Honolulu, HI. I write and publish books on tropical agriculture. I also play and coach soccer.
truevineflorida,We are one Justice away from a five-Justice, ultra-left wing majority that will tear down our Constitutional liberties fundamentally.#TedCruz #TrusTed
Carledavis1967,constitutional conservative, 2nd amendment rights,and supporter of Ted Cruz for POTUS in 2016. let's take our country back and protect our constitution.
surfcitysocal,Stuck in Leftifornia. No votes for progressives no matter what party. #ConservativesAgainstTrump #NeverTrumpOrClinton #DefundPP #COSproject #NoOnSB1146
ChasBrowning,US Air Force Vietnam Vet 66-67 Conservative. Retired railroad. Married up. Charlotte, NC Life's good!
CenterMichele,Conservatarian. #ExGOP Your vote = your business. My vote = my business.
ReCorwin,Christian, Entrepreneur, I Built That, Independent Conservative, Uphold the Constitution and The Bill of Rights and my Pooch #CFA 
#YGLI = You Gotta Love It
MattBrubakerNC,Trophy Husband; Daddy; Christian; #RealEstate Development; SS Teacher @PBCRaleigh; Former #WakeCounty Planning Board; #NCPOL; #Cleveland Sports
Tea4maryland,I talk sports and politics #RavenNation #Terps Alternate account @AntiSJW2731 #God #CruzCrew #Ravens #NeverTrump #Hayek #StandWithRand #TeamBongino #Kathy4MD
MediaCaffeine,An exploration of the #news you've seen... and other news you need to see.
brandondarby,'Patriarchal agent provocateur' and nice guy. Breitbart Texas Managing Director and Editor-in-Chief. I tell people's stories and fight for them.
cnsrvjew,!והוא יהיה פרא אדם כתיב ולא אדם פרא https://t.co/R8zOFywUdi
Keith_Bower,Christ-follower; Distance Runner; President of Dreamers & Doers Unite! and Energy Project Coach, LLC [Banner ©DieselDemon, used by permission]
RobustRepublic,✞God-given#Freedoms
#LifeB4Breath
#ClimateCollusion
#RINOdump2016
►RT≠endorsement  ✪MissMyWWII✈Da

►No DMs
Maddox8212,Love GOD, family, friends, The South, and Crimson Tide.  Constitutional conservative.  Seeking truth and justice for all.
conservativedev,Web and application developers who happen to lean more Conservative or Libertarian - Join us!
#DC #TX #CA #TN #FL
53Nonna88,Nonna to 6 beautiful granddaughters! Proud Conservative. Love watching husband vintage race, NASCAR, F1, IndyCar...all racing!
2AFighterNH,I am a 2nd Amendment and Child Abuse advocate  and will fight to protect both of these issues.
jaredeker,Christian, Husband, Father, Veteran Marine, COS District Captain, III%er
augustogarz,
RLCPa,Republican Liberty Caucus, Pennsylvania Chapter: Fighting for liberty through GOP Primary elections.  Join us!
MN4TedCruz,#CruzCrew #Caucus4Cruz 
Join the #CruzCrew at https://t.co/MJbTmXMTDD
yaronbrook,CEO of the Ayn Rand Institute. Co-author (with @DWatkins3) of Free Market Revolution & Equal is Unfair. Listen https://t.co/e6cDYGafzs
Oohoo3,I'm a Constitutional Conservative!  I love God, family and my beautiful Country!   My opinions reflect my beliefs.  Concerned for our nation.  RT ≠ endorsement.
Carlo_Gino,Automation Developer, Imagineer, Migrante, and truth seeker.
alan1787,Christian: I believe in the Lord Jesus Christ, Husband, Father and Constitutional Conservative. We need these 'The Liberty Amendments (Mark R Levin)'.
kkay64,Daughter ~ Sister ~ Aunt ~ Wife ~ Mother ~ Nana ❤️ Friend ~ Republican ~ American ~ Love Purses, Purple, Wild Flowers & Rain
bluedevildavey,It Never Troubles The Wolf How Many The Sheep May Be ~ Virgil
farm_mom,Conservative, Christian, Farm wife to @1861_again, Stay at home mom of 3 boys, Gardner, Altrium health suppliment dealer, Strict Constitutionalist, Former Nurse
