The_Gnu_JGH,Philosophy Prof.Ratio Christi in Syracuse, NY. Author: Truth in the Flesh: Introducing Apologetics to the Local Church.Resistingthe Dictatorship of Relativism
davyhobson,Paramedic/RN
DavidTennessen,Believer, Hubby, Dad, Marine, Retired Ventura County Sheriff's Chief Deputy
CyberTAP,#HusbandFatherNeighbor Lover of music, running, spirits, cigars, and bacon.  #NRA  #VCDL
JDRucker,#Christian. Husband. Father. #Conservative. Car guy. #TCOT. #CCOT. When in doubt, pray. #ProIsrael. #ProLife. Ephesians 6:12. #NeverTrumpOrHillary
ColtTweets2Much,
pjkate,Christian. Conservative. Pro Israel. Pro Life. 2A. Retired Military Wife. Truth will ultimately prevail where there is pains to bring it to light.- G.Washington
morllturpitude,Slinger of libertarian hash.

Retweets and follows do not necessarily connote approval of said material or Tweeter.  I could be doing it to laugh at your ass.
ZahidaKhan,I'm a wireless woman helping clients market online.  I also coach people 2 transform their lives to live more successful, healthy, happier lives!
Tedgforce,Better off being myself! I already know the clues at the scene of the crime. History rhymes often and hard. Not on Facebook, will not be on Facebook.
CindyBP,Retweets aren't necessarily an endorsement-I am right-therefore I support Ted Cruz, the choice is obvious.
SmartFrogLegs,Contact Joe Dan via the website. This Twitter Acct automated and directly tied to JD's Facebook Acct  Primary Twitter is @JoeDanMedia
wordbfree,A Southern Conservative who loves his family,country,the constitution and freedom. Convention of States.
taxidrvrfor4,Completely devoted to faith, family and freedom.
The_Original_FT,All-around, self-proclaimed aficionado of stuff that matters... to me.
whotnaught,Socialism is a philosophy of failure, the creed of ignorance, and the gospel of envy, its inherent virtue is the equal sharing of misery. Winston Churchill
falcon_koch,Over 35 years in Quality Processes, & Inspection.
iCaucus. Affiliate State Director for Calif. Vetting of Candidates for Federal.

http://t.co/KScyOHVCUk
gmac2775,Scotsman, naturalized Canadian, living in the most anglicized city in North America, family live in France. Wee bit confused sometimes.
elgarresta,Consultor Politico General, de profesion y porque me gusta
rickybobdal,Christian Married Dad Airline Pilot Golfing Jazz-loving Fisherman  Ex-USAF Tanker Toad OU Dad - Boomer Sooner!
KillAtWill,Pro God, Pro Life, Pro Israel... Fiscally conservative independent.
jasonechambers,Believer. Huskies, Seahawks, M’s. Politics. Knight errant to Erika.
wrightdlca,I love my God, My family, My Country
marklangford,Christ-follower•Husband of 1•Father of 2 #NativeTexan #Constitutionalist #Declarationist #Life #TEAparty #Conservative #NRA #Liberty #1Man1Woman #RepealThe17th
evankirstel,#Solopreneur #ForHire: Helping clients w #SocialBiz #Influencer: #IoT #Telecom #Cloud #UComs #Mobile #Enterprise #DigitalHealth #Cybersecurity @UCstrategies
LedgeKing,Reporter covering Florida & the politics of NASA for USA Today Washington Bureau. Loves: Family, basketball and Indy Colts. tweets not an endorsement, etc.
TexasGOP,Official Twitter account for the Republican Party of Texas.
LKiedrowski,USAF retiree. Christian by grace. Pro-life because it is right. 2A because it's my right. If I'm right and I usually am....
andysnark,Cold War Veteran, Economist, Lawyer, Sports Lover. I am a Rakkasan.
WestAustinAg,Faith, family and friends. Aggie sports, technology talk and constitutionally framed/limited government.
wufandmew,Holistic pet health and behavior articles with corresponding pet products, pet pics, pet videos & fun!.
LynneWinfrey,Born Again by God's Grace, Love my dog and horse. Praying the Republic survives. Freedom enthusiast. READ the Constitution!!  #2A
youfoundsarah,Southern gal who loves #travel, #liberty, @drews_views & our crazy dogs. Marketing consultant for the #freemarket. Occasional food & travel blogger.
hern1da1,Infantryman , Doctoral candidate, Conservative and Catholic.
tektonasd,Structural engineer sold out for Christ, husband and proud dad to four.
hgcady,Christian - Wife of @jeremycady - Mom - Columnist - Conservative - Photographer - #tcot
_PatJohnson_,@PatJonsonBackup @PatJohnson_2  #ProLife #TCOT #2A #CCOT #LNYHBT #PJNET #Redstates Standing for LIFE, (Includes Right to protect it) #Freedom is not a #Loophole
Gunservatively,#JESUSisLORD
JaimieMedley,~Athena @/Enemies of Liberalism, graphic artist, #TeamMarco #NeverTrump
JosephEach,God, Family & USA! Proudly followed by @TedCruz / @SenTedCruz who mirrors & defends my conservative principles, morales & values. #ForeverCruzCrew #CRUZILLA
hlopeor,Catholic, American, conservative, I love the constitution of this great nation USA. Ted Cruz  for President  2016
InjunuityInjun,#Indigenous History/Stories #Cultural #Holistic Counselor Educ. #Eco-sustainable #Tourism, #conservative #Liberty #Rez bonafides All things #Supernatural #TWD
nycreligioninfo,We are exploring the postsecular city.

Join us as we travel down all 6,374.9 miles of our  streets to document every religious site in New York City.
snoopduke,Follow of Christ. Horned Frog fan. The Snoopaluke goes to seminary.  Here are some thoughts of mine about life right now.
MrPrincetrumpet,1st trumpet Minnesota Orchestra 34 years and 4 years in Seattle Symphony. Juilliard trained. Co-Music Director of Minnesota Youth Symphony.
AlwaysRightUSA,#Cruz2016 Social/Fiscal cnsrvtive #Baptist Infidel✞Past Prez GOP WomenFederated. Armenian by birth American by choice #RealEstate Broker Dan 2:28 Public Speaker
83Wahoo,Husband, father, conservative, financial advisor
jffree1,5th gen.Texan, libertarian leaning conservative; I tweet news. If you don't want to know what's happening... don't follow me.
ok18879,Father, husband, structural engineer, laissez-faire radical for liberty. If you don't love Jesus, go to hell. #AlwaysConstitution #AllLivesMatter
anideaman,Law abiding citizen. Know yourself and always seek self improvement.
MiguelARIZPE81,Fiscal Conservative, Right Wing, Honesty, Pilot
HitByTorpedo,I laugh at your progressive conditioning.
buttonre,Sarcasm is my middle name
mtmnman,
primos63,
BrandonDNeuman,Constitutional Law Advocate. Writer. Staunch Conservative. Christian.
SolRieger,I voted for @TedCruz, don't blame me when Hillary wins the presidency. #NeverTrump ~ Sales Executive @DirectBlindsNY
PepperGoins,
Babin4Congress,U.S. Representative for the 36th Congressional District of Texas. Follows, RTs, mentions are not endorsements.
MBACampaigns,A conservative consulting firm specializing in campaigns, elections and public affairs.
Maurice Bonamigo
President & CEO
daddy18880,Catholic and Conservative.I reside in the mostly great State of Louisiana.
maryalexcorley,Oklahoma roots. Graphic Designer. Coffee enthusiast.
Coach_Crash,Forsan et haec olim meminisse iuvabit  (Perhaps some day it will pleasant to remember even this.) Virgil's Aeneid
GreerBarnes1,Stand Up Comic. True Patriot. I want *ALL* of America's people to live the American Dream.
JoeJ1513,Bible-believing Christian conservative #CruzCrew #ChooseCruz #Liberty John 14:6
MamaBear4Cruz,#BackTheBadge #IStandWithLEOs #PrinciplesOverParty #IStandWithIsrael #ConstitutionalConservative #CruzCountry #CruzCrew #NEVERTrump #NeverHillary #BearClan
Margrz,
JasOesterreich,Husband, Father, and Christ-Follower
TXSVIKING,Proud Conservative, Heli-Arc Specialist. SBO since 1977, Love BBQ, Guns,  Freedom, Wine, Whiskey and Beer! #TCOT #BossyMonica #PJNET ΜΟΛΩΝ ΛΑBE
ohmgriley,Political junkie, Banker, Catholic, Ted Cruz Conservative & Convention of States activist. Followed by Michelle Malkin, Matt Bevin & Steve Lonegan
JimW_in_NM,Just an old Hinterland Retiree
--- spent 3 years in Combat Zones -- spent 30 years using a Radar Scope to keep Airplanes from colliding with each other
forcerecon430,The United States Marine Corps Force Recon, Now Known as Marine Raiders. Scout Sniper, Conservative, God, Corps and Family.#TRUMP
kevkid79,Marine. Love God & Country. It's Simple: Government needs to be limited and stay out of the way of the people.Stay within the Constitution. Dont forget to Pray.
AngeloAlvarez18,Conservative, Pro 1st & 2nd ammendment, Pro-life, Pro one God Jesus Christ, father, husband
RabbiShmuley,Rabbi Shmuley, who Newsweek & WashPo call ''the most famous Rabbi in America,'' is a world-renowned author of 30 books, broadcaster & a relationships expert.
MrCardasso,Christian. Wife @MrsCardasso. Rocco is my son. Constitutional conservative.
RBeus,Conservative #CruzCrew Proud #CAT #RAT #NeverTrump #NeverHIllary
Hetero_doxy,Toleration isn't opposite intolerance, it's counterfeit of it. Both are despotisms: one assumes itself the right of withholding liberty, the other, granting it.
searchgirl40,information curator
Bridget4Cruz,Proud Conservative American-
Mom to two beautiful people-
Supporter of the Greatest Military in the World-
I was one in a Million at D.C. March 09/12/09
LRCelic,coot & crank in Utah's Dixie.  God bless John Browning
Michael07369542,American Independent
RNRIowa,Iowa #RedNationRising account. Grassroots organization for Education, Constitution and Civics. #IAcaucus #iagov #iapol
HighlandsGOP,Official Twitter Page of the Republican Party of Highlands County, FL.  The HCREC is the governing body. RT does not imply endorsement.
JurAmsbaugh,I am a Ronald Reagan conservative.
fr_gonzales,Pastor of St. Joseph in Beeville, Texas. Catholic Diocese of Corpus Christi, USA
RightnTexas,Proud to be conservative American Texan & Golden Retriever dad. Believe in God, capitalism, & hard work. Despise lying politicians, but love making fun of them.
1776LifeLiberty,Christian, Husband, & Father. My opinions reflect my beliefs as an American concerned for the future of our nation. LESS GOVERNMENT MORE #FREEDOM! #TedCruz2016
daxcontreras,retired band nerd. public relations and predictive analytics professional
dawashington,I'm from Sioux Falls. I've got a wife, some kids and I direct communications for the @BushFoundation. My name is not Trevor.
FieldGeorge,Technology-centric lawyer, experienced in trial work, resolving disputes, scuba diving and Golden Retrievers.  Hoosier Daddy.  Brazil Nut.
ScottJW,Associate editor of @TheMRC's @NewsBusters. Conservative. Politics. Philly sports. Movies. The 1980s. History nerd. William Wheeler FTW!
foxnewslatino,The place to go for news that impacts the Latino community.
geraldj4,Christian; three children and three grandchildren; retired Deputy Chief of Police; FBINA #160; US Army 06/68 - 06/71; conservative.
vonzion,Conservative in principles, actions, habits & morals because of my belief in Jesus Christ. Let's take America back! #ccot #tcot
tcracolice,Government drone
ABRADIOSHOW,Home of The American Beacon Radio Show & Podcast. Written and produced by @ryan_abp  and @billmcmicheals . Visit our site: http://t.co/mahNMvJO
mhaines4102,
930amTheAnswer,930AM The Answer - Breaking News - Stimulating Talk! Bennett/Gallagher/Prager/Medved/Hewitt
Randy_Shannon,Love me some #Liberty +30yrs Electrical Designer - Politics & Sports & #Trance - Love to Cruise - #Rubio Republican
freddoso,God, Country, Notre Dame. And the Cubs -- don't forget the Cubs. Opinion editor, Washington Examiner.
JimmyPrinceton,Conventional wisdom skeptic
cupcakecraze11,Owner~Cupcake Craze Gourmet Cupcakes and Custom Cakes
suzyqla,Conservative Values & Personal Responsibility! Working hard to preserve our Republic; Fighting for our U.S. Constitution!
LeighAnnBellew,Beloved Daughter of the King, Cherished Wife, Respected Mother, Engaging Teacher, Talented Speaker, Thoughtful Writer, Patriot
TomT_FL,Senior writer, Biz Pac Review -- Opinions expressed here are mine alone and do not necessarily reflect the views of any other entity.
RWince,Passionate about #digital #IoT #innovation #leadership #change #cocreation #health and #healthcare
amazoncomvideo,India Herbs | Ancient Remedies for Modern Times.. - See more at: http://t.co/CoDjWONO3b
FLPatriotMom07,Co-Fo FLParentsRISE☀ US Patriot☀ Mom of 7 & Grammy to 6 ☀ Military mom of 3 boys ☀ Homeschool mom = Prayer warrior, Abundant love, Blessings, & Joy! ERAU Alumna
Dawn_R_Morgan,Mom; Grandma; Spiritual Christian; Night-Sky Watcher
panther72117,I am into writing, politics, commodities, nutrition, science and poetry. View My Blog http://t.co/sU6jAUWa
reluctantzealot,Don't even try to tell me I have to choose between Trump and Hillary.  Will never happen.  I have alternative with Small Govt outsider libertarian choice.
eliseashton1,I will be the first to say #IToldYouSo and I will rub it in https://t.co/4r5qlECX3C #NeverHillary #NeverTrumpForever #NeverTrumpOrHillary #AlwaysConstitution
seths2cents,#NeverTrump as of 5/3/16 Trump says Cruz dad was supporter of JFK killer. Get this straight HE abandoned me. It was a setup from beginning. Division from within
RyanSitton,Experienced businessman and oil & gas engineer for TX Railroad Commissioner
txlatinchic,I work for my DAD. He has the best job benefits EVER. :). Today's a great day to love somebody that needs it! Conservative Latina. RT not nec End.
Rene_gadeCowboy,Security consultant/USAC/Shifter Karts/410/360 sprints 11x /Ret Navy IS2/ Dog lover/Troop supporter/ Opinions expressed R my own. : caution Not a Trump fan..
Hopper_Lee,Chief Operating Officer https://t.co/cC38YzO3tt | Hillsdale College Alumnus | Skier, golfer, corn hole player, sports pundit, & fan of capitalism | #Rockies
ThePatriotFile,Curated Conservative News - Biased Towards Conservative Values
eriksson_magnus,Republican-Conservative-Father #PJNET #RedNationRising #UniteRight #NRA #2A #TedCruz2016
SovereignYou,You O Citizen of the #USA and I are responsible for preserving individual, state, and national #sovereignty. Will you finish throwing it all away?
matthew_peddie,I host a show called Intersection on WMFE 90.7 FM, Orlando's public radio station. Call in fridays at 9am 1-866-338-5252
mattcaldwell_fl,7th gen. Floridian. Passionate defender of constitutional limited government and individual liberties. Honored to represent the people of Lee County, Florida.
SGPAExPat,Conservative educator, Writer at http://t.co/Ui6GPLNWHK, Military wife, NavyVet & mother. Politically active and deeply concerned about our country's direction.
ArtGisi,Republican, political activist and Cathie and Caty show Producer, Director and cameraman.
younce,President, Younce Consulting Group, LLC; MO Native; St. Louis Cardinals Fan; Opinions my own; RT≠ Endorsement
willyz,Tweet some. Few followers. Pathetic, really.
Veribatim,@SCFYRs Chair; former Comms & International for @YRNF; @TheIJR politics editor; interests genY, tech, Syria, post-USSR, NGOs, wine. Married @TheNorwegianFox
bradatay,USN, Vietnam Vet:  Serial Golfer - 
My definition of Intent, is, & Conservatism is probably different from yours, but I don't vote Democrat - ever!
BenjiBacker,Proud American & cheesehead. Fan of WI sports, snow, and the outdoors. #NeverTrump before it was cool. UW-Seattle 2020. Instagram: @benjibacker.
JeffPerry6,Christian Conservative American who believes in the constitution and fights for biblical principles and values and won't apologize for it
CLPartyTX,https://t.co/1QmWMyAa1i
I am not GOP I am a Constitutional conservative
WhittyMike,Texas expat living in the Midwest; I use Twitter for politics, interests, and hobbies, Facebook for friends and family, and Linked In for business/professional
FollowingTrend,Horses, Ravens, Reagan, Nationals, Bourbon, and Buccaneers. #MakeAmericaGreatAgain #AmericaFirst
bigsexy_tote,EC3's #1 Fan. #NeverTrump Conservative, ΜΟΛΩΝ ΛΑΒΕ, #2A. #TWD, #AtlantaFalcons, #NYMets, #TNA wrestling. Followed by @EthanCarterTNA @ZemaTNA @TheWalkingDead
patriot17761980,Libertarian conservative college student Anti-SJW, Anti-Jihad, Pro-Capitalism, Pro-Constitution and Pro-Freedom #USOutofUN
jphilman0206,Libertarian. #ExGOP. #NeverTrump #NeverHillary #AlwaysConstitution I want a Federal Govt small enough to fit in COTUS.
woodnwheel,Find me on Facebook (see URL)
JosephCrampton1,Reader, writer, and retweeter
KevinMinott,Writer - Future Author #CHALK https://t.co/VVZ5JymBGS
B_Sandusky,Enjoys animals & nature, loves #soccer, #Colorado sports fan, HS Coach (c license-#ussoccer), loves #God, professional engineer (HVAC) in #WY, #SD, & #MT
thirdlantern,
GunClipVideo,Believe in life, liberty and the freedom to pursue happiness. 

#2A

Follow me and I will follow you.
Foxchick242,Lived in Poland for 20 years. I understand the dangers of a big, centralized government. #TedCruz2016 #TCOT #CCOT #MARKLEVIN #IAMBREITBART
drinkwat,Common sense constitutional conservative.
CowboyJeffSucks,Conservative. Infidel. Snarky Fan fan. Howard Stern & Cowboys fan. Song parodies. #2A #PJNET #TCOT #CruzCrew #הַשֵּׁם #TeaParty #StandWithIsrael #NeverTrump
TheJeffGoldman,Marketing strategist and avid pursuer of truth, justice and the American way.
FarmerDave_Lane,Dairyman, Farmer, Husband and Dad, Conservative political junkie, K-State fan, Pun master and observationer, used employee trader
noelbagwell,Writer. Lawyer. Speaker. Entrepreneur.
usnchap9609,Former US Marine (Sergeant); retired Naval officer (LCDR). Husband and father of two sons (a Marine and a College business major)! Ted Cruz supporter!
Kelsonus,Conservative in the liberal wasteland of MD  Tech junkie  Irish  Mimic  Horrendous prognosticator  Moderately humourous
#CruzCrew
jwnks,
AbolishTheFed,#GaryJohnson2016
conservativesue,#Jesus #TeamJesus #BeTheFew
RepMattKrause,Christian, Husband, Father, Conservative & Republican. Constitutional Attorney. Proudly represent HD 93 in the Texas Legislature.
DPSimcho,
garymoore1985,I have a rapid-fire intellect, & sense of humor. My eyes light up, when talking about either politics, music, or anything sexual. I love thrills!
anchorwomen,#CCOT - Conservative Christians on Twitter - that's me in a nutshell. I am a former #Trumpster who realized how liberal he is and shifted to join #CruzCrew.
GWashingtonInde,Sociologist; studies+tweets re:evangelicals; tweets my own~poltcl ind~native Txn~ULM alum~@DCExaminer @JamesRosenFNC @TheIRD @IJM @CSLewisInst @edstetzer follow
chad_stanford,In West Tennessee.  Time to get back to the Founding Fathers' principles and a small Federal government.  #NRA
AlDupas,Vet of USN (USS Narwhal SSN 671),  #ProLife #NRA Christian prepper Tar Heel/Car Panthers/Char Hornets/ManU fan/UFC
MinneMike,Proud husband. Father of 4 young men & 2 young ladies. Former Global Fortune 500 company exec. Now business owner and man for all (sports) seasons.
CherylBesser,Conservative.  Wife.  Mother.  Proud to be an American.
#CruzCrew #Cruz2016 #UniteWithCruz #ChooseCruz

profanity = blocked
gayla415,Texas born,NY Raised,Wife,Mother,Followed by Ted Cruz, &Alveda King, CONSTITUTION,Conservative,Love God,Family,FreedomFighter Liberty #TGDN #TCOT #PATRIOTS LD23
MarvinPreston,Dad, American Airman, pontificator, patriot, cigar & whiskey aficionado, foodie/aspiring chef, world traveler and all around righteous dude
Catronicus,Health care consultant, contributor to American Spectator.
Dcarter888K,Retired Wall St Political Junkie #NoProgressives #UpholdConstitution #NoAmnesty #SecureBorder #NoCronyCapitalism #RealPeople #JakeCrew #JasemanCrew #CruzCrew
Tundraeyes,Believer in God - AF Brat - Membr Grace Revolution Church (JPM)  John 3:16 #CCOT #TGDN #TCOT #TGDNTexas †✡
BACFA,Bread and Circuses for America: dedicated to the documentation of the period of American history known as the Fundamental Transformation (ΜΟΛΩΝ ΛΑΒΕ)
borodisciples,A Disciples of Christ Church - Seeking Transformation - In an Ancient Beauty always being Made New!
stenhankewitz,Novelist; editor; journalist; historian; geostrategy analyst; Deputy Editor @EstonianWorld; fiscal conservative; social liberal; Republican; Jewish; American.
PatJohnson_10,Backup acct to @_PatJohnson_ 
#ProLife, Life, & (#2A) Protection of Life, Liberty  Liberty Pursuit of Happiness #Stand4Life #Tcot #CCOT #LNYHBT
TeraliAm,Passionate for Christ and America, Land that I Love #CruzCrew #TheHumanRight
Medaton,Conservative, teacher, co-managed campaign for winning State Secretary of Agriculture   #TeamBuckLadies   #ShieldsHigh  #TeamBuck #CruzCrew
TooRight_,Christian. Constitutionalist. Capitalism or nothing. Fighting the regressive left. Ex-member of the GOP
1americus1,Christian, Mother and Grandmother. RN retired. Retweet may not mean endorsement. (No DM) CRUZ2020 AgitatorsRblocked
burrbunch,Christian, Libertarian, Constitution,SiFi Buff, Roman History, #ProLife, pro #2A, love USA, disabledVet, #TCOT #CCOT RT no-endorse, VP Quality&Safety
Hughes_Charles,Rancher, oil man, attorney, real estate broker, gold seal flight instructor, knight templar, 32 degree, Original Constructionist, husband, Southern Baptist.
MissSchwendy,Christian, Mother to Aidan, Sister, Friend, Patriot #ProLife #2A #Cruz2016
TheDailyBabble,The Daily Babble is a #libertarian, #conservative & #freemarket page.  We believe in The #Constitution, #AustrianEconomics, #Liberty & #Christ. #TLOT #TCOT
NOCOOL95,I'm American Retired Truck Driver husband father and grandfather of three individual patriot 
 conservative pro-life i love  god family and friends
thisistippingpt,Tipping Point CEO Dane Waters has more than 25 years of national and international experience connecting people and translating ideas into action.
butterflygail,Christian, Wife, Mom, Friend, avid Dordt College Basketball fan, reader, only listen to Christian music, tech-junkie, Love Butterflies!
nascargege,GOD first, others, then self. Grandkids, Daughters/spouses, friends.  Rodeo, PBR, NASCAR
Semperfivet,Founder Veterans OneStop , Former Marine Vietnam Veteran, New Car Dealer, Cancer Survivor, Christian, Republican, Father of Eight, Dedicated to Helping Veterans
Mariacka,Conservative American Patriot, but - always - Christian first, above politics. Re-tweets are not endorsements by me.
krlapotin,Political junkie/strategist & writer by day, Philadelphia sports fan extraordinaire by night. All views are my own, not my employers'. RTs etc. ≠ endorsements.
melton_alex,Follower of Christ. Husband to Kelli. Father of Rebekah and Elijah. Youth & College Pastor at @FBCCookeville. @UCF & @SBTS Alum.
jkeithgrogan,
hplem,Proud mom of adult daughter & son. Catholic. Conservative. #ExGOP #tcot #CruzCrew #NeverTrumpOrHillary #AlwaysLiberty. I bleed Ranger blue. #NYR #NYY #NYK #NYG
oabryant,Perennial student of biblical studies, native Texan, patriot, advocate of founding principles, the Constitution and decentralization. #NeverTrump
Gladiator8658,My Name is Gladiator; Jesus is Lord; The Constitution is Sacrosanct; Semper Fidelis; No Infringement.
uberstephanie,USMC daughter; Army vet; proud military mom; ❤️my GSDs; Vegetarian/Conservatarian #ISRAEL #NeverHillary #BDSFail
PatriotLaura,Completely fed-up American citizen! #2A #Constitutionalist #CruzCrew #NeverTrump ZERO-TOLERANCE for #Trumplestilskins
mattgiese,Die hard @Cubs & @Panthers fan! Enjoy Traveling, Movies, @GOP, & Country Music (especially @kennychesney). Proud @northerniowa grad of 08'
McCarthyKnew,Wife. Mother of 2. College prof. It's not dem vs. GOP; it's global vs USA. #rednationrising #neverhillary
ChaelMontgomery,#Art #BadArt #Remixology #MGWV #TFB #F4F #DropOutHillary Curated news feed has been moved to @OuvrezLeChien ... bitches!
MikeEaster,Follower of Jesus, Husband of my High School Sweetheart, Dad to 2 great kids, Conservative Libertarian, Boomer Sooner! #TGDN and Now a Grandpa!
4_scribe,
RickCanton,When you inform yourself w/facts, the truth is easy. Blocking me is your #SafeSpace. #TurnVARed #NeverHillary, #TeamMarco, ISFJ @MarisaDawn is my Cuban sister.
leeclapp,Clapp Brother's Cleaners'   (delivery truck driver) in the 50s and lived in Bay City, Michigan then, until 1956.
daviddlpe,#Courageous #Christian #Constitutional #Conservative #2A, #ccot, #tcot @TedCruz #CruzToVictory #CruzCrew #TedCruz2016 - #DumpTrump - #TrumpLies - #NeverTrump
usarespnsblty,With liberty comes the need for personal responsibility. Let The Ten be your tool of highest power & authority for guidance & protection of liberty.
He11Cat,#Conservative #NeverTrump #tedcruz #FantasyFootball #Sewing #Cats 
 #TVaholic #TWD #movies
MLJDC,Podesta Group; former Chief Counsel to @JohnCornyn; MD resident, but Texas will always be home
KataAndKumite,Conservative with a sense of humor. If you don't like it too bad.  #TGDN
UtahFreedomConf,Utah's freedom-loving grassroots org's joined together in Sept. 2010 to launch the 1st Utah's Freedom Conference.  In 2012, it was Sept15th. See our website.
arping,Constitutional Conservative Forester NRA USAF. Our USA is the Greatest Nation on the Only Planet man occupies (Yet). One Nation One Language One people NObama!
Staci4AU,Wife, mom, Auburn fan, pop culture junkie with a pretty keen ability to see it for what it is. Fabulous taste in shoes, even better taste in friends.
2eyesnears,Eyes & Ears Are God-Given Gifts But Watch&Listen With Heart&Mind To Discover For Yourself Everyday The True&The Good #AlwaysConstitution
alexandraswann,Alexandra Swann has a master's degree in history & blogs regularly about the impact of excessive regulation. For UKIP former Tory follow @AlexandralSwann
JohnDVernon1,I am a Conservative Independent. Retired Army Colonel (32 yrs) Christian, Pro-Life, Pro-2nd Amendment, fiscal & social conservative, love my country & state.
BillViolaJr,Husband, father and business owner.
Reenit,MOTHER of 3, LOVE God, Country, People, Politics, & Our U.S. Military. TOLERANCE & APATHY ARE THE LAST VIRTUES OF A DYING SOCIETY ~UNKNOWN [ProfanityFreeZone]
Unruly_Govern,Time for #WeThePeople to take back our government from the corrupt and the power-mongers.  #Libertarian  #Constitution #1A #2A
CruzCrewSue,3 kids, married HS Sweetheart & bestfriend, tech exec, Oxford comma extremist, Alt Cruz delegate! #MGoBlue #PJNET FB Dinesh D'Souza! I'm a Jewish Methodist
